id,post_id,name,email,body
179142,266583,Kanaka Dutta,kanaka_dutta@flatley.example,Ea cumque distinctio. Harum aut deleniti. Atque possimus pariatur.
179141,266582,Annapurna Nehru,nehru_annapurna@olson.example,Velit aut voluptatem. Officiis et doloribus. Porro ducimus sunt.
179140,266581,Prayag Jain,prayag_jain@oconnell.example,Assumenda qui qui. Aliquam eligendi ullam. Occaecati impedit dolor. Dolorum velit tempora.
179139,266581,Chandramohan Bandopadhyay,chandramohan_bandopadhyay@marks.test,Quibusdam ut magni.
179138,266579,Durgeshwari Guneta,durgeshwari_guneta@walsh-lindgren.example,Quam quibusdam velit. Rem aliquam cum. Modi voluptas iusto.
179137,266579,Bakula Asan,asan_bakula@dooley.example,Explicabo nulla ut.
179136,266577,Amrit Kaul,amrit_kaul@sauer.example,Necessitatibus rem quia. Nobis ducimus et. Mollitia autem possimus. Vitae minima quis.
179135,266577,Prof. Ekaksh Somayaji,ekaksh_somayaji_prof@adams.test,Inventore dolores asperiores. Quisquam nostrum commodi.
179134,266575,Oormila Kaul Ret.,oormila_kaul_ret@oconner.example,Nisi nemo eos. Sit nisi quos. Earum eveniet hic.
179133,266574,Geeta Joshi,geeta_joshi@hintz.example,Aliquid non et. Aut quia doloribus.
179132,266574,Gorakhanatha Ganaka,gorakhanatha_ganaka@simonis.test,Est dolorem non. Dolor est pariatur. Ratione deleniti molestiae. Sit eaque consequatur.
179131,266572,Pramila Malik,malik_pramila@padberg.test,Est quasi et.
179130,266571,Daevika Marar PhD,phd_daevika_marar@glover.test,Quas illum voluptatem. Alias ut blanditiis. Eaque suscipit et. Nemo sed rerum.
179129,266571,Nagabhushanam Guneta Sr.,nagabhushanam_sr_guneta@fadel-funk.test,Cupiditate unde tempora. Ut voluptates voluptatibus. Quisquam molestiae harum. Est ut in.
179128,266569,Ekaksh Pandey LLD,lld_ekaksh_pandey@barrows.example,Ut voluptatem corporis.
179127,266569,Prof. Triloki Gill,gill_prof_triloki@gislason.test,Blanditiis ea tempora. Officia est ipsum. Illum dolorem neque. Facere reiciendis vel.
179126,266567,Gov. Chatura Prajapat,chatura_prajapat_gov@swift.test,Ut sed nam.
179125,266567,Kanaka Pothuvaal,kanaka_pothuvaal@batz.example,Illum rem deleniti. Ab autem numquam. Praesentium pariatur consequatur. Alias doloremque maxime.
179124,266566,Aatmaj Bhattathiri,bhattathiri_aatmaj@walker.example,Esse reiciendis rerum. Dolorem possimus ex. Minima id omnis.
179123,266566,Vedanga Kaniyar Esq.,kaniyar_vedanga_esq@funk-roob.example,Qui modi quod. Iusto a aut. Enim minima et.
179122,266564,Chaaruchandra Jain,jain_chaaruchandra@ratke-bartell.test,Dolores autem magni. Quae mollitia sit. Dolor mollitia natus. Deleniti autem aut.
179121,266563,Dhaanyalakshmi Bhattacharya,dhaanyalakshmi_bhattacharya@breitenberg.test,Debitis amet eum.
179120,266561,Msgr. Sucheta Jha,msgr_sucheta_jha@oreilly.test,Architecto rerum distinctio. Tempore ipsum et. Laboriosam culpa amet. Ipsum reiciendis ab.
179119,266558,Dinesh Jain,jain_dinesh@howe.test,Deleniti atque optio. Repellendus unde non.
179118,266556,Devdan Devar,devdan_devar@feest-herzog.test,Et at aut. Est asperiores rem.
179117,266556,Miss Suryakant Chopra,suryakant_chopra_miss@leffler.test,Excepturi deserunt eveniet. Error qui tempore.
179116,266554,Bhavani Adiga,bhavani_adiga@walsh.test,Dolor voluptate accusantium. Ad iste officiis.
179115,266554,Anilabh Pilla,anilabh_pilla@schoen.test,Sit dolorem quibusdam.
179114,266553,Dharani Chopra,chopra_dharani@lakin.example,Reiciendis aperiam blanditiis. Hic iste est.
179113,266552,Mrs. Nagabhushanam Nambeesan,nagabhushanam_mrs_nambeesan@hilpert.example,Eos inventore blanditiis. Non est quisquam.
179112,266552,Rev. Somnath Joshi,joshi_somnath_rev@rippin-bernier.example,Fuga dolorem nihil. Optio nihil eveniet. Omnis doloribus velit. Nisi est quod.
179111,266551,Abhirath Mehra,abhirath_mehra@okuneva.example,Impedit nobis deserunt. Necessitatibus veritatis esse. Incidunt et eum. Quia at eos.
179110,266551,Chandni Tagore,tagore_chandni@walter-hirthe.test,Eius voluptatem qui. Enim dicta minima. Quae repellendus a. Provident enim molestias.
179109,266550,Shakuntala Varma,shakuntala_varma@cormier.example,Id voluptate voluptas. Illo delectus inventore. Eaque reprehenderit ab. Architecto id ratione.
179108,266550,Chakradhar Guha,chakradhar_guha@okuneva-cremin.example,Eius est voluptates. Odit aut possimus. Voluptates quas aliquid.
179107,266549,Fr. Purnima Kaul,purnima_fr_kaul@steuber.test,Aut unde iure.
179106,266549,Eshita Pillai Sr.,eshita_sr_pillai@vandervort.example,Quas porro voluptas. Sapiente et pariatur. Dolorum voluptatem suscipit.
179105,266548,Bilva Guneta,guneta_bilva@fadel.example,Sint accusamus totam. Est autem tenetur.
179104,266547,Anish Malik,anish_malik@roob-kshlerin.test,Dignissimos voluptas perferendis.
179103,266546,Amaranaath Dwivedi CPA,amaranaath_dwivedi_cpa@windler.example,Non debitis molestiae. Ullam eveniet alias. Fugit cum quo.
179102,266545,Uttam Sethi,sethi_uttam@corwin-gorczany.example,Eos maiores nobis. Labore laborum dolorum.
179101,266545,Amb. Aamod Ahluwalia,amb_ahluwalia_aamod@fahey.example,Et assumenda aspernatur. Reprehenderit vel non. Omnis aut sed.
179100,266543,Gajadhar Jha,gajadhar_jha@stiedemann-boyer.example,Nam unde aut. Est aliquid earum. Sint provident a.
179099,266542,Goswami Pothuvaal,goswami_pothuvaal@blanda.test,Aut ducimus iste.
179098,266541,Bharadwaj Bharadwaj,bharadwaj_bharadwaj@yost.example,Facilis ex adipisci. Nam iusto dolorum.
179097,266541,Divaakar Nambeesan,nambeesan_divaakar@trantow.test,Dolore nemo et. Omnis asperiores deserunt.
179096,266538,Ms. Bakula Tagore,tagore_bakula_ms@hartmann-turner.example,Natus suscipit sint.
179095,266538,Smita Joshi,joshi_smita@frami.example,Doloremque aperiam sint.
179094,266535,Brahmanandam Kapoor VM,vm_brahmanandam_kapoor@beahan.test,Commodi perferendis distinctio.
179093,266534,Ritesh Jha,jha_ritesh@friesen.test,Voluptas cumque eligendi. Aspernatur rerum illum. Quibusdam tempora sit. Repellendus provident animi.
179092,266532,Baidehi Devar Jr.,devar_jr_baidehi@ortiz-berge.test,Sint voluptate quidem. Sint neque ut. Ad laboriosam molestiae. Dignissimos aliquid est.
179091,266532,Indra Kapoor,indra_kapoor@murazik-abshire.test,Tempore odio blanditiis. Nisi quo occaecati. Suscipit pariatur vel. Assumenda doloremque culpa.
179090,266531,Shashi Gowda,gowda_shashi@prohaska.example,Id minima est. Consectetur eius deserunt. Exercitationem ex consectetur. Quasi consequatur et.
179089,266530,Suman Kakkar,suman_kakkar@hirthe.test,Velit fugiat cum. Sapiente ipsam non. Deserunt in commodi.
179088,266529,Vidhya Varrier,varrier_vidhya@kub.example,Repellendus et quas. Sint neque eaque.
179087,266525,Deven Talwar,deven_talwar@mohr.example,Tenetur nemo neque. Id modi aut.
179086,266524,Puneet Marar,marar_puneet@auer.test,Laborum architecto sit.
179085,266523,Meghnad Acharya,acharya_meghnad@bechtelar-pfannerstill.test,Repellat quod quas.
179084,266522,Amogh Chattopadhyay,chattopadhyay_amogh@kiehn.example,Saepe quaerat alias. Omnis eos non.
179083,266522,Omana Nambeesan DVM,omana_nambeesan_dvm@cruickshank.test,Quaerat eveniet voluptas.
179082,266521,Chandani Kaniyar,kaniyar_chandani@wolff.test,Et veritatis nemo.
179081,266520,Amb. Kamalesh Joshi,joshi_amb_kamalesh@emmerich-klein.example,Commodi molestiae sit. Non laboriosam est.
179080,266520,Geetanjali Menon,menon_geetanjali@kuhn.test,Praesentium voluptas beatae.
179079,266519,Ashok Mishra Ret.,ashok_mishra_ret@abshire-paucek.example,Qui velit occaecati. Maiores quasi pariatur.
179078,266519,Bhaanumati Sinha,bhaanumati_sinha@terry.example,Inventore pariatur similique. Eum laborum qui. Et ut et. Id et repudiandae.
179077,266518,Anwesha Nambeesan,anwesha_nambeesan@hammes.test,Animi excepturi autem. Et provident porro. Qui officiis est. Voluptates expedita id.
179076,266518,Nawal Talwar,nawal_talwar@tremblay.test,Voluptas in est. Ea quisquam ut. Natus omnis officia. Eum asperiores sed.
179075,266517,Dipali Marar,marar_dipali@hamill-maggio.test,Excepturi sequi ea. In vel veniam. Aliquam ex voluptas.
179074,266514,Pres. Vasudha Patil,vasudha_pres_patil@roob.example,Non beatae unde. Non qui nisi. Repellendus minima qui. Asperiores tempore rerum.
179073,266513,Deepankar Mehra,mehra_deepankar@ryan.test,Dicta repellendus asperiores. Dicta sunt voluptas. Et optio recusandae.
179072,266513,Chitraksh Namboothiri,chitraksh_namboothiri@stroman.example,Perspiciatis amet culpa. Dolores tenetur labore. Beatae quia dolor.
179071,266511,Lakshmi Chattopadhyay,lakshmi_chattopadhyay@walsh.example,Minus odit omnis. Voluptatem fuga repudiandae. Adipisci animi debitis.
179070,266511,Nawal Marar,nawal_marar@osinski.example,Veritatis doloribus sed. Necessitatibus quam velit.
179069,266510,Kailash Kakkar Sr.,kakkar_kailash_sr@hoeger-swift.example,Pariatur nihil placeat. Id libero est.
179068,266510,Chetan Bharadwaj,bharadwaj_chetan@koch-lang.test,Sit sequi quia. Deleniti velit odio. Laudantium et sunt.
179067,266509,Yogesh Chaturvedi,chaturvedi_yogesh@goodwin.test,Et qui omnis. Numquam optio inventore. At molestias quas.
179066,266508,Sarala Kaul,kaul_sarala@schoen.test,Praesentium ea dolores. Recusandae maiores nemo. Magni amet maxime.
179065,266508,Gajadhar Banerjee,gajadhar_banerjee@okuneva.test,Aut enim temporibus. Earum id ut. Provident quasi ea.
179064,266507,Bilva Mahajan,mahajan_bilva@kemmer.example,Modi repellat consequatur. Et cupiditate unde. Libero et non.
179063,266507,Charuchandra Mehra,mehra_charuchandra@olson-king.example,Debitis facere tenetur. Aperiam voluptatem non. Velit eum cupiditate.
179062,266503,Anuja Mehrotra,anuja_mehrotra@goyette.test,Commodi aut quo. Ut vitae minus.
179061,266503,Abhaidev Ahuja,abhaidev_ahuja@hammes.example,Veritatis repellendus rem.
179060,266502,Rakesh Dhawan,rakesh_dhawan@lueilwitz.example,Atque debitis saepe. Reiciendis alias quasi.
179059,266502,Amb. Preity Marar,preity_amb_marar@watsica.test,Laudantium architecto deleniti. Reprehenderit vel est. Sunt est tempora. Voluptatem reiciendis dicta.
179058,266500,Vijay Achari,vijay_achari@carter-roob.example,Porro temporibus incidunt. Magni recusandae nam.
179057,266500,Pres. Dev Arora,dev_arora_pres@keeling.example,Veritatis repellendus explicabo. Ea aut excepturi. Ut ut quia.
179056,266499,Shwet Verma,shwet_verma@osinski.example,Possimus minima quas. Saepe error et. Qui reprehenderit ab. Eos necessitatibus quidem.
179055,266496,Fr. Agnimitra Chattopadhyay,fr_chattopadhyay_agnimitra@doyle.test,Consequatur unde autem. Quisquam qui inventore.
179054,266494,Acharyasuta Nair,acharyasuta_nair@bartoletti-beatty.test,Voluptatibus at quod.
179053,266493,Budhil Reddy,reddy_budhil@walter-nader.example,Debitis saepe non. Illo culpa non. Incidunt aut aliquid.
179052,266493,Gajbaahu Sharma,sharma_gajbaahu@metz.test,Fugit voluptatum ducimus. Sequi magnam aperiam. Cumque ut quas. Dignissimos quis perferendis.
179051,266492,Ananta Gowda DO,ananta_do_gowda@herzog.example,Quo similique pariatur. Quod sint ut.
179050,266492,Chidananda Guha,guha_chidananda@gusikowski.example,Molestias iste ratione. Labore ducimus molestias. Omnis enim nostrum. Consequatur et voluptatem.
179049,266491,Vijay Patel CPA,patel_cpa_vijay@rath-bosco.test,Nesciunt exercitationem omnis. Veritatis animi quia.
179048,266491,Rohit Saini,saini_rohit@rau.test,Adipisci sequi non. Autem quo consectetur. Praesentium et tempora.
179047,266490,Tanushri Prajapat DVM,dvm_tanushri_prajapat@cole.example,Quis blanditiis consectetur. Nihil consequatur itaque.
179046,266490,Anang Verma,anang_verma@senger.example,Porro labore earum.
179045,266489,Msgr. Deepan Mahajan,deepan_mahajan_msgr@jacobs.example,Et rerum sed.
179044,266489,Ramesh Patel PhD,phd_ramesh_patel@keebler-braun.example,Qui vero dicta. Aliquam nisi earum.
179043,266488,Mukesh Dutta,mukesh_dutta@tillman.example,Quod et et.
179042,266488,Prem Banerjee,prem_banerjee@strosin.example,Veniam quisquam pariatur. Voluptatem tempora quia.
179041,266487,Akshat Tagore,tagore_akshat@schaefer.test,Optio mollitia qui. Voluptas magnam explicabo.
179040,266483,Ekdant Malik,ekdant_malik@dietrich.example,Explicabo exercitationem rerum.
179039,266480,Rev. Dipendra Shah,dipendra_rev_shah@johns-beahan.test,Nostrum nihil alias.
179038,266479,Anagh Singh,singh_anagh@tremblay-balistreri.example,In voluptate qui. Et tempora et. Occaecati quo fugiat.
179037,266478,The Hon. Harita Bhattacharya,bhattacharya_harita_the_hon@donnelly.test,Quia consequatur et. Aut sit excepturi. Quod aliquam aliquid. Et necessitatibus consequatur.
179036,266477,Chitrangada Chaturvedi DC,chitrangada_dc_chaturvedi@towne.test,Sint quis rerum. Facilis corrupti sequi.
179035,266476,Dron Shah,dron_shah@cassin.example,Rem ea laborum. Facere eum excepturi. Architecto ipsa vitae. Est sed voluptatem.
179034,266476,Jaimini Panicker,jaimini_panicker@oberbrunner.test,Ut deserunt minima. Rerum ipsam ea.
179033,266473,Bandhu Tagore,tagore_bandhu@huel-rice.test,Eligendi ut nostrum.
179032,266473,Kanishka Bhat,kanishka_bhat@beer.test,Quibusdam cumque nam.
179031,266468,Agnivesh Chaturvedi,chaturvedi_agnivesh@altenwerth.example,Cum vel iusto. Quis qui sequi. Non saepe neque.
179030,266467,Amogh Kaul,amogh_kaul@robel.test,Doloribus consequatur qui. Officiis id animi. Nulla aliquam voluptas.
179029,266466,Ujjwal Kaniyar,ujjwal_kaniyar@oberbrunner.example,Velit ad excepturi. Impedit aliquam fugit. Rerum tempore officia. Eligendi non amet.
179028,266465,Mina Pillai,mina_pillai@schulist-dare.example,Commodi beatae fugiat. Minus blanditiis ut.
179027,266465,Bhargava Khanna,bhargava_khanna@adams.test,Et qui corporis. Temporibus eum et. Quod aut ea. Officiis dolor qui.
179026,266464,Anasuya Panicker,anasuya_panicker@strosin.example,Quis illum omnis. Ut sequi corporis. Rerum dolorem nisi. A distinctio iure.
179025,266463,Rukhmani Marar,marar_rukhmani@rowe-ankunding.example,Molestiae vel est. Corrupti laborum quisquam. Culpa quaerat dolorum. Debitis voluptates consequuntur.
179024,266462,Rohan Gandhi,rohan_gandhi@harvey-leuschke.test,Sed et dignissimos.
179023,266462,Divaakar Agarwal,agarwal_divaakar@pollich.example,Esse in vel.
179022,266461,Arjun Embranthiri DDS,dds_arjun_embranthiri@hodkiewicz-rowe.example,Qui sit ut. Omnis nihil vel.
179021,266460,Vedang Khatri,khatri_vedang@renner-kunze.test,Quod nam laborum.
179020,266460,Anwesha Pandey,anwesha_pandey@homenick-fadel.example,Cupiditate et non. Doloremque ab sint. Totam aut unde.
179019,266459,Chandani Pothuvaal,chandani_pothuvaal@oconnell.example,Cupiditate voluptatum ut. Dolor repudiandae aliquam.
179018,266457,Purnima Deshpande,deshpande_purnima@schuster.test,Beatae impedit at. Eius voluptas dolorem. At consectetur laboriosam.
179017,266456,Chandni Bhattathiri,bhattathiri_chandni@shanahan-huels.example,Aperiam deserunt qui. Numquam voluptas ipsum.
179016,266456,Dhaanyalakshmi Deshpande III,iii_deshpande_dhaanyalakshmi@hansen-harris.example,Dolores voluptatum voluptatem. Hic corporis quia. Harum a unde. Et dolor rerum.
179015,266455,Gajadhar Kakkar III,kakkar_gajadhar_iii@schumm.test,Quidem amet eos.
179014,266455,Miss Harit Agarwal,agarwal_harit_miss@ortiz.example,Est at autem.
179013,266454,Bhushan Acharya,bhushan_acharya@witting-mueller.example,Dolorum distinctio in. Dolor est culpa.
179012,266452,Kanaka Joshi,kanaka_joshi@jenkins-friesen.example,Modi aut provident. Maiores sapiente explicabo. Atque necessitatibus eum. Illum odit nihil.
179011,266450,Krishnadas Mukhopadhyay,krishnadas_mukhopadhyay@bernhard.example,Ullam id nulla. Aut porro cumque.
179010,266450,Mani Banerjee,mani_banerjee@gleason.test,Velit aut harum. Et accusamus excepturi. Modi minus delectus. Dolores quia quis.
179009,266448,Miss Sarala Ahuja,sarala_ahuja_miss@rath-gutmann.test,Aut iure voluptatem. Ratione asperiores beatae. Eaque et delectus. Voluptas quia aut.
179008,266448,Susheel Pothuvaal,susheel_pothuvaal@hettinger-goodwin.example,Vero dolor ea. Quo rerum nemo. Molestias laborum reiciendis. Aut voluptatibus et.
179007,266447,Ganak Bhattacharya,bhattacharya_ganak@mills.test,Ea iusto non. Maxime voluptas aut. Laboriosam ut ducimus.
179006,266447,Aagneya Malik,aagneya_malik@lebsack.test,Mollitia accusantium fuga.
179005,266446,Dev Banerjee,dev_banerjee@leuschke.test,Nisi sit qui. Harum ipsum est.
179004,266445,Ananta Pillai,ananta_pillai@zboncak-prohaska.example,Aut repudiandae est.
179003,266445,Aishani Khan,khan_aishani@hamill-wehner.example,Voluptatem vitae voluptates.
179002,266444,Tanushree Nayar,nayar_tanushree@schultz-howell.example,Corporis incidunt facere.
179001,266444,Karthik Chopra,chopra_karthik@bahringer.test,Nihil vel est. Quidem eligendi pariatur. Consequuntur quas quo. Et facilis quas.
179000,266443,Chakor Marar,chakor_marar@lesch.example,Modi odit unde.
178999,266443,Mr. Esha Butt,butt_esha_mr@carter.test,Et unde quo. Quae esse ducimus. Velit sunt aut.
178998,266442,Akula Patil,akula_patil@rippin-smith.example,Unde totam quos. Eos rerum illo.
178997,266442,Sen. Alok Tandon,alok_tandon_sen@murphy-dietrich.test,Expedita amet soluta. Et numquam aut. Rerum temporibus excepturi. Delectus dolorum aperiam.
178996,266441,Laxmi Patel MD,md_laxmi_patel@cremin.test,Praesentium quae reprehenderit. Natus quas quia. Soluta voluptate et. Qui quo blanditiis.
178995,266439,Divakar Kaul,divakar_kaul@lebsack.example,Et omnis ducimus. Et optio eaque. Voluptatem quas exercitationem. Aut est quis.
178994,266438,Himani Shukla LLD,himani_shukla_lld@terry.example,Doloribus aspernatur rem.
178993,266437,Chaaruchandra Achari,chaaruchandra_achari@bins.test,Sed perferendis omnis. Minus nobis molestiae. Distinctio quam sed. Quo fuga nam.
178992,266436,Jagdish Khatri,khatri_jagdish@beer.test,Maxime architecto vero. Itaque vel animi. Voluptas sit necessitatibus. Nesciunt voluptatem alias.
178991,266434,Gatik Mukhopadhyay,mukhopadhyay_gatik@fahey.test,Id sint ut. Dignissimos rerum totam. Harum ut nisi.
178990,266433,Baala Panicker,baala_panicker@douglas.test,Nihil incidunt aliquam.
178989,266430,Devani Patel,devani_patel@ohara.test,Quas est labore. Possimus soluta id. Dignissimos fuga rem. Ut quod sequi.
178988,266429,Geeta Sinha I,geeta_i_sinha@rogahn-romaguera.test,Nihil amet est. Maxime itaque minima. Aut voluptatem accusamus.
178987,266429,Chandra Prajapat,chandra_prajapat@marvin.test,Tempora nihil omnis. Nisi sed sint.
178986,266428,Bhadraksh Mukhopadhyay,mukhopadhyay_bhadraksh@harber-runolfsdottir.example,Ut dolorum ut. Est voluptas itaque.
178985,266427,Dr. Niro Chattopadhyay,dr_niro_chattopadhyay@paucek-kovacek.test,Optio aut saepe. Quia repellat dolor. Autem sit et.
178984,266425,Digambar Bharadwaj,digambar_bharadwaj@nikolaus.example,Reprehenderit nulla vel.
178983,266424,Rameshwar Kaur,kaur_rameshwar@nader.test,Quia alias quo.
178982,266424,Mrs. Atmaja Tandon,tandon_atmaja_mrs@harvey-lang.test,Repellat quia in. Asperiores est sunt. Sit sunt repudiandae. Magni vel accusantium.
178981,266422,Mrs. Yogesh Khanna,mrs_yogesh_khanna@bode.test,Sed dicta optio. Enim consequatur reiciendis. Eaque in consequuntur.
178980,266422,Chatur Agarwal Esq.,agarwal_chatur_esq@schmitt-schroeder.test,Ducimus error dicta. Aperiam totam corporis.
178979,266421,Deeptimoy Varma DVM,deeptimoy_varma_dvm@becker-sanford.example,Quae nostrum voluptatem.
178978,266420,Mukesh Dwivedi,mukesh_dwivedi@willms-hoeger.test,Odio nihil voluptate. Nostrum error sunt. Molestiae quidem quam. Quis autem dicta.
178977,266418,Anala Butt,anala_butt@hagenes-wuckert.test,Ipsa illo voluptatem. Quaerat necessitatibus qui. Et sequi et.
178976,266417,Nagabhushanam Mehrotra,mehrotra_nagabhushanam@keebler-swaniawski.test,Est omnis magni.
178975,266415,Deepan Abbott,abbott_deepan@feeney-schinner.example,Enim modi saepe. Nemo et quis. Ex laudantium officia. Et dolores quisquam.
178974,266414,Siddhi Menon,menon_siddhi@leuschke.example,Ullam tempora sit. Nostrum omnis quia. Blanditiis corporis exercitationem.
178973,266413,Bilva Varma IV,varma_bilva_iv@okuneva.example,Quasi voluptatem qui. Et consectetur est.
178972,266413,Chandraprabha Pothuvaal,pothuvaal_chandraprabha@wyman.test,Enim dolore officiis. Sit optio similique.
178971,266411,Rep. Opalina Gandhi,opalina_rep_gandhi@kemmer.example,Qui iste aut.
178970,266410,Harinarayan Bhattathiri I,harinarayan_i_bhattathiri@gleichner.test,Temporibus fugit voluptas. Dolor quidem eligendi.
178969,266409,Vrinda Butt,butt_vrinda@gusikowski-corkery.example,Provident numquam id. Numquam autem eligendi. Possimus ea cum. Quos quia consequatur.
178968,266409,Charvi Ganaka,ganaka_charvi@roberts.test,Quia maiores fuga. Voluptas tempora velit.
178967,266406,Deeptimay Somayaji,deeptimay_somayaji@rempel.example,Amet sed quam. Fuga ipsa ea.
178966,266404,Puneet Khanna Sr.,puneet_sr_khanna@fritsch-fadel.example,Qui et ab. Voluptatum ea ab. Eius velit nulla.
178965,266403,Jitendra Tandon,tandon_jitendra@herman-romaguera.example,Officia fuga laudantium. Rem inventore incidunt. Et iste natus. Facilis molestiae odit.
178964,266403,Prof. Dhanesh Mukhopadhyay,dhanesh_mukhopadhyay_prof@turner.example,Tenetur veritatis et. Et atque neque. Doloribus et ipsa.
178963,266402,Baalagopaal Abbott,abbott_baalagopaal@roob.test,Optio quod odit.
178962,266402,The Hon. Purushottam Khanna,the_khanna_hon_purushottam@jenkins.example,Animi hic enim.
178961,266401,Yogendra Kaur,yogendra_kaur@keebler-grimes.test,Ipsum impedit dolore.
178960,266400,Dipendra Chaturvedi,dipendra_chaturvedi@moore.example,Aut laborum beatae. Error rem amet. Laborum magni ut.
178959,266400,Aatmaj Pandey,pandey_aatmaj@gulgowski-hegmann.test,Quia in et. Nobis vel at.
178958,266399,Anurag Prajapat,anurag_prajapat@emmerich.test,Ipsam consequuntur quis.
178957,266399,Chaten Khan,khan_chaten@white-shields.example,Harum facere ea. Tenetur incidunt ut.
178956,266396,Bhavani Tagore Jr.,bhavani_tagore_jr@beier-keeling.test,Explicabo doloribus sit. Nemo ad et. Harum et quia.
178955,266394,Indira Patil,indira_patil@conn.example,Eius ipsam veritatis. Alias sint perferendis. Nulla numquam unde.
178954,266394,Deb Chaturvedi,deb_chaturvedi@okeefe.example,Eveniet dolorem aliquam. Distinctio mollitia ab. Ducimus soluta officia.
178953,266393,Dharani Bhat,dharani_bhat@schroeder.example,Dolores tempora nostrum. Aspernatur at neque.
178952,266392,Prema Kaur,kaur_prema@powlowski.example,Sit maxime modi. Corrupti ipsa officia. Est magni inventore. Aut tempore minus.
178951,266392,Ujjwal Deshpande,ujjwal_deshpande@cronin-brakus.test,Ea magni et.
178950,266391,Ananta Nair,nair_ananta@murazik-schmeler.example,In omnis et. Officiis maxime nobis. Dolor qui qui. Nam mollitia est.
178949,266390,Aarya Marar III,iii_aarya_marar@bradtke.example,Sunt qui nihil. Eos minima odit. Atque vel architecto.
178948,266390,Ganesh Jain,ganesh_jain@walker.test,Est excepturi tempore. Error facilis aut.
178947,266389,Gautama Tandon,gautama_tandon@haag-tillman.example,Repudiandae rerum autem. Eaque quidem inventore. Assumenda corrupti modi.
178946,266388,Preity Dubashi,preity_dubashi@hegmann.example,Suscipit et quaerat. Aliquid quia eveniet. Ut voluptatem explicabo.
178945,266387,Bela Mehrotra,mehrotra_bela@labadie.example,Molestiae ea tempore.
178944,266386,Kashyapi Prajapat,kashyapi_prajapat@bechtelar-kemmer.test,Est enim non.
178943,266385,Mrs. Kannen Banerjee,kannen_mrs_banerjee@gleichner-blick.test,Enim voluptatem corporis.
178942,266383,Jai Verma,verma_jai@moore.example,Excepturi quo ipsum.
178941,266381,Eshana Guha,eshana_guha@rath.test,Maxime officiis aspernatur. Aut et nisi.
178940,266379,Deependra Tandon,deependra_tandon@bartell.test,Reprehenderit et delectus. Qui dolor necessitatibus. Libero eum consequatur.
178939,266377,Jagdish Asan,jagdish_asan@glover-beer.test,Voluptate nihil placeat. Blanditiis asperiores earum. Magni id eaque.
178938,266376,Aadinath Gowda,gowda_aadinath@lebsack.test,Eveniet autem facilis. Sed saepe recusandae. Est quo laboriosam. Voluptate magnam quasi.
178937,266376,Dinesh Pothuvaal,pothuvaal_dinesh@okuneva.test,Et rem quia.
178936,266374,Ganapati Namboothiri,ganapati_namboothiri@kilback.test,Maiores sunt consequuntur.
178935,266374,Girindra Ahluwalia,girindra_ahluwalia@turner.test,Dicta ad expedita.
178934,266373,Lakshman Devar,lakshman_devar@lynch-baumbach.example,Ab aspernatur non. Ut voluptas quis.
178933,266373,Chandraketu Kaur,kaur_chandraketu@von-cassin.example,Molestiae eveniet doloremque.
178932,266372,Rev. Niro Varma,rev_niro_varma@kunde.test,Fugit quaerat culpa.
178931,266372,Gudakesha Verma,verma_gudakesha@nader.example,Dicta consequatur voluptas. Accusamus sed dolor.
178930,266371,Ambar Somayaji,somayaji_ambar@boehm.test,Omnis et velit. Ut reiciendis delectus. Sed ullam sed.
178929,266368,Chanakya Ganaka I,ganaka_i_chanakya@waters.test,Iusto sed possimus.
178928,266368,Ramaa Jha,ramaa_jha@toy-cassin.example,Sit dolores dolor. Voluptate magni consequuntur. Et expedita nam. Atque unde voluptas.
178927,266367,Chaturaanan Naik I,chaturaanan_i_naik@herman.test,Dolores sit ratione. Laborum reprehenderit deserunt. Praesentium ut consequuntur.
178926,266367,Gov. Chandra Kocchar,kocchar_gov_chandra@pouros-kuvalis.example,Et cupiditate rem. Ut harum non. Amet aut quaerat. Sit quis sunt.
178925,266364,The Hon. Suresh Gowda,hon_gowda_the_suresh@predovic.example,Rerum fugiat perferendis. Voluptas voluptate quos. Voluptas molestiae quia. Quo aut ratione.
178924,266363,Aanand Bhat Esq.,esq_bhat_aanand@gleason-dicki.example,Est eius nisi. Quia cupiditate ipsa. Quia consectetur aut. Omnis est quisquam.
178923,266362,Kalinda Arora,arora_kalinda@conroy-mante.test,Ipsa accusamus impedit. Necessitatibus et officia. Aut labore quidem. Voluptatum placeat omnis.
178922,266362,The Hon. Bhudeva Chattopadhyay,the_hon_bhudeva_chattopadhyay@macgyver.test,Ipsa non neque.
178921,266361,Bhaasvan Bandopadhyay,bandopadhyay_bhaasvan@kutch-kilback.test,Omnis cum et. Minus consequatur error. Et voluptas accusantium.
