id,post_id,name,email,body
180019,267487,Anilaabh Sharma Esq.,anilaabh_esq_sharma@west.example,Non eveniet aut. Rerum enim alias. Et nihil nobis.
180018,267487,Dhatri Embranthiri,embranthiri_dhatri@bechtelar.example,Rerum tempore inventore.
180017,267485,Deveshwar Kaniyar,kaniyar_deveshwar@jones-stracke.example,Illo autem quam. Qui hic ut. Sed nemo suscipit. Harum quia id.
180016,267484,Mandaakin Varrier DC,dc_mandaakin_varrier@collins.test,In eum ipsam. Voluptatibus minus officiis. Sunt et et. Porro quas maxime.
180015,267484,Anshula Embranthiri,anshula_embranthiri@mayer.example,Tenetur quis ab. Omnis est dignissimos. Eos ut possimus. Ut praesentium saepe.
180014,267483,The Hon. Deependra Asan,hon_deependra_asan_the@kreiger.test,Odio quisquam ipsa. Molestias dolor adipisci. Dignissimos quia hic.
180013,267483,Aaditya Singh,aaditya_singh@west.example,Dolores eos sint.
180012,267482,Chandraayan Varrier,chandraayan_varrier@jaskolski.example,Est itaque voluptatem. Velit ex quas.
180011,267481,Ranjeet Khan,ranjeet_khan@koss.example,Maxime nulla eum. Dolores dolorem aperiam.
180010,267477,Subhashini Mahajan,subhashini_mahajan@kunze-howe.example,Voluptate et et. Molestiae et voluptatum. Velit animi voluptate.
180009,267476,Nalini Kaul,nalini_kaul@pollich-larson.example,Harum cumque vitae. Reiciendis iusto fugit.
180008,267474,Sen. Kumuda Acharya,kumuda_acharya_sen@schinner.example,Repellat non aspernatur. Consequuntur dignissimos quia.
180007,267474,Veda Acharya JD,jd_veda_acharya@nolan-cruickshank.example,Optio accusantium vel. Ipsa praesentium veritatis. Tenetur quia et.
180006,267473,Basanti Joshi,joshi_basanti@walker.test,Eum sed qui. Excepturi ex ipsa.
180005,267473,Gautama Chaturvedi,gautama_chaturvedi@skiles.example,Voluptas consequatur eos. Consequatur beatae error. Tenetur repellendus quos.
180004,267469,Advaya Ahuja,ahuja_advaya@dooley.example,Autem possimus totam. Veniam suscipit mollitia. Laboriosam blanditiis minus. Quia hic ab.
180003,267469,Sanjay Guneta PhD,sanjay_phd_guneta@pouros.test,Molestiae ut nisi. Blanditiis incidunt modi. Repudiandae necessitatibus explicabo.
180002,267466,Achintya Khanna,khanna_achintya@herman-howell.example,Aut et quae.
180001,267466,Ms. Bhaumik Khan,bhaumik_ms_khan@macejkovic-smitham.test,Est odio in. Sit dolorum explicabo. Consequatur natus sit. Provident iure veniam.
180000,267465,Anurag Banerjee,anurag_banerjee@runolfsdottir.example,Consequuntur suscipit qui. Voluptatem aut voluptas. Reiciendis sunt inventore. Vel consequatur aliquam.
179999,267464,Rudra Acharya,rudra_acharya@schmeler-schneider.test,Rem iusto accusamus. Hic unde non.
179998,267464,Saraswati Nehru LLD,nehru_saraswati_lld@fadel-hoppe.example,Occaecati et odio. Sequi est dolorem. Aliquam quod qui. Dignissimos quos qui.
179997,267463,Lakshmi Kaur,lakshmi_kaur@leuschke.test,Iste excepturi officia. Dolores aut possimus. Amet rem rerum. Sed aut excepturi.
179996,267463,Deepali Butt,deepali_butt@brakus.test,Delectus eveniet perspiciatis.
179995,267462,Deeptiman Somayaji,deeptiman_somayaji@ledner.test,Deleniti autem laboriosam. Numquam dolorum est. Qui sit sint. Iusto eveniet sapiente.
179994,267461,Dr. Dharani Prajapat,prajapat_dr_dharani@ruecker.example,Quo voluptatem consequuntur.
179993,267461,Aanand Tandon IV,aanand_tandon_iv@hessel-abbott.example,Vitae enim itaque. Error amet voluptatem.
179992,267459,Ekaksh Patel,patel_ekaksh@metz.test,Qui magnam qui. Qui neque ut.
179991,267459,Shreya Sethi,sethi_shreya@conn.test,Laborum tempora rem. Quo ea corporis. Animi enim sunt.
179990,267458,Bhisham Varrier,varrier_bhisham@bailey.test,Numquam explicabo veniam. Rem minima molestiae. Quia repudiandae deleniti.
179989,267458,Mrs. Digambara Ahluwalia,digambara_ahluwalia_mrs@wisoky.example,Reprehenderit est dicta. Et aut quis. Temporibus aliquid hic. Rerum dolore facilis.
179988,267457,Gov. Gurdev Tagore,gov_tagore_gurdev@nolan.example,Iure qui quam. Omnis est eum. Deserunt et nam. Nulla iure placeat.
179987,267456,Akshata Namboothiri,akshata_namboothiri@stiedemann.example,Id non aut. Quidem libero amet. Adipisci corrupti non.
179986,267456,Chitrangada Mehrotra V,mehrotra_chitrangada_v@ohara.example,Nesciunt deleniti alias. Nobis qui ducimus. Assumenda aut ex.
179985,267453,Chitrali Mehra,chitrali_mehra@willms.test,Perspiciatis ut sunt.
179984,267453,Bhagwanti Arora,bhagwanti_arora@dietrich-herzog.example,Natus perspiciatis pariatur. Ut quis exercitationem.
179983,267452,Deevakar Acharya LLD,acharya_deevakar_lld@crooks-lang.test,Eligendi non quia.
179982,267452,Mrs. Gemine Agarwal,gemine_agarwal_mrs@powlowski-kuhn.test,Aut dolorum unde. Magnam quo sit. Accusantium consequatur nostrum. Ullam est aut.
179981,267450,Ganak Pandey,pandey_ganak@oconnell.test,Tempore tenetur est. Temporibus aut dignissimos. Earum culpa id.
179980,267448,Mr. Tarun Nehru,tarun_mr_nehru@beatty.example,Quis sint qui. Qui sint dolore. Et et nostrum. Corrupti perspiciatis et.
179979,267448,Deepesh Somayaji,deepesh_somayaji@bergstrom.test,Velit deserunt quos. Ipsum rerum ipsam.
179978,267445,Deevakar Joshi,joshi_deevakar@weber-zieme.test,Qui odit aliquam.
179977,267442,Rajinder Kocchar Sr.,sr_rajinder_kocchar@hackett.example,Vel velit enim. Totam fugiat aut.
179976,267442,Darshwana Ganaka PhD,phd_ganaka_darshwana@wintheiser.test,Facilis nihil dicta. Soluta sapiente atque. Consequatur ut autem. Itaque distinctio sit.
179975,267441,Adripathi Nayar,adripathi_nayar@becker.test,Eligendi maiores possimus. Tempora nisi sunt.
179974,267441,Goswamee Mukhopadhyay,mukhopadhyay_goswamee@lesch-greenfelder.example,Quo officiis qui. Et dolor necessitatibus. Ea laboriosam dolorum.
179973,267440,Baidehi Mehrotra,mehrotra_baidehi@wisoky.example,Dicta ipsam nemo. Molestiae nihil temporibus. Minus corporis nulla.
179972,267440,Chandranath Kakkar,chandranath_kakkar@bernhard.test,Hic quisquam explicabo. Enim veniam quia.
179971,267438,Menaka Trivedi,menaka_trivedi@rodriguez.test,Ad dignissimos facere. Architecto sed odio. Quod architecto aliquam. Doloremque maiores possimus.
179970,267437,Bala Butt,bala_butt@kshlerin.example,Eum et facere. Reiciendis placeat iusto. Est et aperiam. Rerum quisquam fugiat.
179969,267436,Sen. Balamani Acharya,sen_balamani_acharya@will-shields.test,Sit laboriosam asperiores. Nulla quia dolore. Eos quis aut.
179968,267436,Tanushree Shah,shah_tanushree@mante.test,Vero ut necessitatibus. Nulla et iure.
179967,267435,Shreya Malik,malik_shreya@lueilwitz.example,Numquam voluptates perferendis.
179966,267435,Dinakar Joshi,joshi_dinakar@reichert.example,Officia temporibus doloribus. Iste beatae quia. Qui sit rerum.
179965,267434,Miss Bela Pillai,pillai_miss_bela@bosco-ritchie.example,Ut soluta aliquam.
179964,267434,Chandrakin Arora Esq.,chandrakin_arora_esq@ratke.example,Quisquam et quam. Consequuntur dolorum veritatis. Omnis ea est. Suscipit illum dignissimos.
179963,267431,Brijesh Pothuvaal V,v_pothuvaal_brijesh@wunsch-oberbrunner.test,Earum consequuntur ea. In voluptatem ipsam. Et numquam perspiciatis. Hic ipsum et.
179962,267427,Gov. Tanirika Sinha,gov_sinha_tanirika@kohler.example,Consectetur eveniet deserunt. Omnis delectus illum. Rerum reiciendis nihil. Quasi eum odio.
179961,267427,Ganaka Deshpande,ganaka_deshpande@kshlerin.example,Sed id architecto. Voluptatem et blanditiis.
179960,267426,Anuja Pilla,anuja_pilla@kutch.example,Et rerum est. Omnis incidunt sint. Eveniet accusamus repellat. Dignissimos saepe nihil.
179959,267424,Chitraksh Reddy,reddy_chitraksh@weber.test,Incidunt voluptates dicta. Aut ab quam.
179958,267424,Dharitri Abbott,dharitri_abbott@mosciski.test,Aliquam voluptatem molestiae.
179957,267423,Rev. Kannan Verma,kannan_rev_verma@funk.example,Quia blanditiis animi. Doloremque culpa eaque. Velit cumque ex.
179956,267421,Charak Joshi II,charak_joshi_ii@collier.test,Quaerat et sint.
179955,267420,Bhramar Khatri,bhramar_khatri@ward-schultz.example,Sit recusandae dolor.
179954,267420,Anshula Tandon,tandon_anshula@ernser-doyle.test,Dolores temporibus magnam.
179953,267419,Chandrani Verma,verma_chandrani@waters.example,Porro deleniti fuga. Fuga esse facere. Provident ut autem.
179952,267417,Goswami Arora,arora_goswami@mitchell-blanda.example,Fugit in et. Iure ut repudiandae. Minima rem reiciendis.
179951,267417,Pres. Sharmila Devar,devar_pres_sharmila@friesen.example,Qui voluptatem est. Iste et quo. Sapiente aliquam earum. Ex delectus voluptas.
179950,267416,Draupadi Pillai Sr.,sr_pillai_draupadi@hoeger.test,Et et labore. Possimus ratione delectus. Dolore ducimus sint.
179949,267414,Dandak Gupta,dandak_gupta@boyer.test,Et dicta nihil. Cum quasi hic. Sed quia fugit.
179948,267414,Ekalavya Varma,varma_ekalavya@jones.test,Incidunt et eum. Aperiam cum at.
179947,267413,Chaten Bhat IV,iv_bhat_chaten@bosco.test,Recusandae sunt enim.
179946,267413,Amaresh Jain V,jain_v_amaresh@hodkiewicz.test,Voluptatem nesciunt non. Harum adipisci assumenda.
179945,267412,Dr. Gayatri Kocchar,gayatri_kocchar_dr@nader.test,Eligendi sit cupiditate. Et reiciendis atque. Consequatur quos dicta. Iure sed cumque.
179944,267412,Brajendra Asan IV,asan_brajendra_iv@orn.example,Sint voluptatem consequatur. Aperiam consectetur possimus.
179943,267411,The Hon. Kalpana Dubashi,kalpana_hon_the_dubashi@champlin-boehm.test,Sit beatae alias. Omnis consequuntur iste. Et dolorem iste. Quia repellat et.
179942,267410,Eshita Abbott,eshita_abbott@emmerich.test,Mollitia enim eum.
179941,267410,Mandakini Kakkar DO,do_mandakini_kakkar@sauer.test,In sint consequatur. Ea vel dolorum. Assumenda voluptatem aut.
179940,267408,Chitraksh Nair,nair_chitraksh@harvey-dubuque.example,Voluptatem nisi illo. Vel dolores necessitatibus.
179939,267408,Ojaswini Kakkar DVM,kakkar_ojaswini_dvm@kerluke.example,Explicabo non quasi. Est aliquid architecto.
179938,267406,Dipendra Mishra,dipendra_mishra@kertzmann-gibson.example,Quia tempore voluptatem. Aspernatur enim et.
179937,267406,Purushottam Iyer,iyer_purushottam@yost.example,Enim sed mollitia. Eveniet accusamus impedit.
179936,267403,Fr. Upendra Agarwal,upendra_agarwal_fr@ernser-cormier.test,Fugit minus ut. Et sed quas. Aut qui corrupti. Et qui rerum.
179935,267403,Udai Sethi,udai_sethi@barrows-stiedemann.test,Saepe id sint. Sed enim aut.
179934,267402,Shankar Singh,singh_shankar@conn.test,Fugiat eum similique. Et voluptatem suscipit. Ut corrupti expedita.
179933,267401,Anamika Panicker,panicker_anamika@lesch.example,Provident esse libero. Culpa est architecto. Hic eveniet qui.
179932,267401,Kannan Pillai,kannan_pillai@kemmer.test,Accusantium consequuntur neque. Rerum quisquam sed. Nihil eos voluptatum.
179931,267400,Chandramani Joshi JD,joshi_jd_chandramani@kertzmann-yundt.test,Recusandae optio et. Sed facere fugit. Voluptas sunt recusandae. Iure voluptates totam.
179930,267397,Msgr. Bhargavi Chattopadhyay,bhargavi_msgr_chattopadhyay@stanton.test,Perspiciatis optio consectetur. Quae est praesentium.
179929,267396,Anang Abbott CPA,anang_abbott_cpa@fadel-zulauf.test,Odio aliquid consequuntur.
179928,267395,Rep. Chakravartee Johar,chakravartee_johar_rep@oconner.test,Est aliquam modi. Qui quidem natus. Sunt provident autem. Nesciunt voluptatum laudantium.
179927,267394,Subhashini Ahuja,subhashini_ahuja@rau.example,Et non enim. Labore at voluptatibus.
179926,267393,Sen. Jay Marar,marar_sen_jay@kutch.example,Harum voluptatem qui. Ut omnis nihil. Aut et quia. Velit autem accusantium.
179925,267393,Gopee Tagore,tagore_gopee@swift.test,Temporibus at consequatur.
179924,267392,Lakshminath Mahajan,mahajan_lakshminath@collins-aufderhar.test,Consequatur rerum doloremque.
179923,267391,Chakrika Nair,nair_chakrika@koepp-goyette.example,Quibusdam voluptatem repellat. Explicabo at optio.
179922,267391,Mr. Aatmaja Khatri,mr_khatri_aatmaja@harvey-jenkins.example,Corporis aut dolor.
179921,267389,Vimala Johar,vimala_johar@schimmel.test,Maiores vel similique. Explicabo aliquam ut. Vel id ipsa. Excepturi est vel.
179920,267386,Aanandinii Marar LLD,marar_lld_aanandinii@doyle.example,Quos exercitationem qui. Fugiat rerum rerum. Commodi ad repellat. Omnis voluptatum necessitatibus.
179919,267385,Gitanjali Achari,achari_gitanjali@heller.test,Omnis fuga quasi. Qui et et. Sit vel ipsa.
179918,267385,Gauranga Gupta,gauranga_gupta@grady.example,Optio at ut.
179917,267384,Purushottam Gupta Sr.,sr_gupta_purushottam@cormier-price.test,Laudantium a omnis. Velit nihil soluta. Consequatur nihil harum.
179916,267382,Mr. Vedang Dwivedi,vedang_dwivedi_mr@mills-koss.test,Numquam ut atque. Expedita commodi quia. Eligendi est reprehenderit. Rem porro esse.
179915,267382,Rev. Baidehi Chopra,chopra_baidehi_rev@kuhlman.test,Quos dolorem non. Autem maiores id. Saepe molestias soluta. Ut aperiam consequatur.
179914,267381,Mr. Chandini Nambeesan,nambeesan_chandini_mr@stamm-osinski.test,Et et sed. Est necessitatibus est. Nesciunt consequatur quibusdam. Illum cumque aperiam.
179913,267381,Damayanti Marar,damayanti_marar@bernhard.test,Accusantium consectetur accusamus. Nobis earum qui. Est quis ducimus. Nobis ullam culpa.
179912,267377,Divya Mishra,divya_mishra@marquardt.example,Nihil perspiciatis eligendi.
179911,267377,Bilwa Embranthiri,bilwa_embranthiri@mcclure.example,Labore id maiores. Autem quae cum. Quam placeat aut.
179910,267376,Daksha Patil,daksha_patil@daniel-bruen.test,Voluptas atque dolores. Quibusdam nemo esse. Id dolorum et. Minima suscipit sed.
179909,267375,Chandrani Kocchar,chandrani_kocchar@tremblay.test,Earum iure at. Aut libero consequatur.
179908,267374,Kashyap Achari,kashyap_achari@ward.test,Eum dolorum nemo. Error consequatur eligendi. Ut ipsa minus.
179907,267373,Mr. Deepankar Gupta,deepankar_mr_gupta@stroman.example,Similique sed voluptatum.
179906,267373,Achalesvara Namboothiri,namboothiri_achalesvara@walter.example,Aperiam consequatur officiis. Consequatur inventore enim.
179905,267372,Daevi Jha V,jha_daevi_v@glover.example,Quo incidunt sit. Et sint voluptatem. Cupiditate maiores consequatur.
179904,267372,Daevika Bhattathiri,daevika_bhattathiri@block.example,Possimus tenetur ducimus. Optio sit aut. In debitis itaque. Exercitationem et magnam.
179903,267371,Ashlesh Verma,ashlesh_verma@heathcote.example,Nisi labore repudiandae. Eum ullam rem. Ratione sunt unde. Commodi similique delectus.
179902,267370,Sen. Ramaa Sharma,sen_ramaa_sharma@reilly.example,Id debitis temporibus. Officia dolore eligendi.
179901,267369,Chakrika Marar,chakrika_marar@batz.example,Occaecati in odit. Voluptatem occaecati ad. Sed quia voluptas.
179900,267369,Goswamee Prajapat Sr.,sr_goswamee_prajapat@reilly.example,Dolorum id in.
179899,267367,Mahendra Nair,mahendra_nair@mccullough-simonis.example,Commodi beatae dolores. Veniam quia odit. Enim ut tempora.
179898,267365,Kiran Kocchar,kocchar_kiran@nitzsche.test,Aut eos vitae.
179897,267365,Msgr. Rageswari Kapoor,kapoor_rageswari_msgr@jakubowski.example,Tempore iusto ex. Temporibus reprehenderit ea. Sit deleniti porro. Error voluptate quia.
179896,267364,Dinesh Verma,verma_dinesh@gutkowski.test,Vero voluptatem optio.
179895,267364,Balachandra Dwivedi PhD,dwivedi_phd_balachandra@lebsack.test,Doloremque saepe explicabo. Harum sint nihil. Voluptas voluptatem incidunt. Rerum ut ex.
179894,267361,Baalagopaal Nair,nair_baalagopaal@gislason-kuhn.example,Magni voluptas est.
179893,267361,Mayoor Kapoor,kapoor_mayoor@beahan.test,Suscipit aperiam non. Facere neque voluptas. At itaque eos.
179892,267360,Aadrika Devar Esq.,devar_esq_aadrika@hammes.test,Libero vero cum. Blanditiis enim eum. Quo nam officiis.
179891,267358,Uma Malik,uma_malik@hane.test,Est qui odit. Dolorum et est. Voluptas repellendus est. Soluta tenetur non.
179890,267358,Gurdev Abbott DO,gurdev_abbott_do@macgyver-okon.test,Quos consequatur officiis.
179889,267357,Ms. Kannan Desai,desai_kannan_ms@smitham-gleichner.test,Vero doloremque nihil. Hic ut provident. Ut voluptatibus vitae. Sapiente eos quibusdam.
179888,267356,Surya Somayaji,surya_somayaji@bednar.test,Qui ea eveniet. Ipsa eum provident. Fuga quia ratione. Quo molestiae blanditiis.
179887,267354,Vrund Gupta,vrund_gupta@nicolas-erdman.test,Enim repellendus et. Dolorum aut est. Ipsum quod quae.
179886,267354,Ambar Khan,khan_ambar@gislason.test,Natus eos id.
179885,267353,Charvi Kaniyar I,i_kaniyar_charvi@keeling.example,Accusantium officiis excepturi.
179884,267353,Devdan Bhat,bhat_devdan@effertz.example,Est pariatur quia.
179883,267352,Ms. Gayatri Kaul,kaul_gayatri_ms@lemke.example,Labore at facere.
179882,267352,Tanushri Gill,tanushri_gill@schimmel.test,Dolorem quis fugiat. Qui sed omnis. Aut consequuntur veniam.
179881,267351,Meghnad Kaniyar,kaniyar_meghnad@larson.test,Expedita blanditiis sunt. Aut illo quis.
179880,267348,Aamod Khatri,khatri_aamod@auer-kessler.example,Vel ex quia. Recusandae natus reiciendis. Laborum cupiditate labore. Numquam qui nesciunt.
179879,267347,Baladitya Embranthiri,embranthiri_baladitya@baumbach.example,Eos velit soluta. Qui et doloribus. Quaerat officiis et. Placeat aut qui.
179878,267347,Devagya Mukhopadhyay IV,devagya_mukhopadhyay_iv@hermann.example,Autem cum dignissimos. Sed quidem dicta. Nesciunt eos ipsam.
179877,267346,Devak Nehru,devak_nehru@thompson.example,Laborum eaque id. Illo aut veniam. Est non et. Rem maxime qui.
179876,267346,Ujjwal Talwar,ujjwal_talwar@mertz.test,Vero eum deleniti. Est aut doloremque. Sapiente deleniti sint.
179875,267344,Mukesh Pothuvaal VM,pothuvaal_vm_mukesh@trantow-quitzon.test,Consequatur dolorem nostrum.
179874,267343,Kumari Asan DC,dc_asan_kumari@miller.test,Quam iste rerum.
179873,267343,Saraswati Bhattacharya,bhattacharya_saraswati@thompson.test,Et placeat quo.
179872,267342,Sharda Mehrotra,sharda_mehrotra@homenick-littel.test,Neque iusto eos.
179871,267340,Mrs. Indra Sethi,mrs_sethi_indra@simonis-hettinger.test,Dolor quaerat atque. Qui amet cupiditate. Laudantium provident occaecati. Perferendis eum molestiae.
179870,267339,Pushti Pilla,pushti_pilla@koss-ziemann.example,Dolorum voluptatem possimus. Nisi pariatur voluptatem.
179869,267338,Varalakshmi Menon,menon_varalakshmi@corwin.example,Consequuntur ipsum dolorem. Aut laudantium molestiae. Doloremque vel et. Quia minus ad.
179868,267337,Daevi Panicker Esq.,daevi_panicker_esq@schroeder.test,Ut aliquam enim. Placeat exercitationem impedit. Velit porro voluptatem. Impedit deleniti dolores.
179867,267336,Susheel Pilla,susheel_pilla@abshire-monahan.test,Omnis impedit eum. Occaecati debitis qui.
179866,267336,Mandaakin Kapoor,mandaakin_kapoor@bernhard-kautzer.test,Veritatis repellat et. Et autem esse.
179865,267335,Diptendu Nair Esq.,nair_diptendu_esq@walsh.example,Qui aut necessitatibus. Enim id voluptates. Ducimus velit sint. Et earum veritatis.
179864,267335,Chandi Butt CPA,chandi_butt_cpa@dare.test,Asperiores aut quia. Sunt quia velit. Sed et et.
179863,267334,Pushti Gill,pushti_gill@wiza.test,Ea officiis voluptas. Inventore doloribus laboriosam.
179862,267334,Harinakshi Banerjee,harinakshi_banerjee@sipes-wolf.test,Dignissimos fuga maiores.
179861,267332,Shreya Gandhi,gandhi_shreya@barton.example,Rem quibusdam magnam. Voluptas aspernatur consequatur. Consequuntur velit nihil.
179860,267331,Dayaananda Reddy,dayaananda_reddy@kertzmann.example,Quisquam maiores sed. Alias et ducimus.
179859,267329,Dhanalakshmi Gupta,dhanalakshmi_gupta@schulist.example,Sed sed vel. Illum facere voluptatum.
179858,267328,Chaturbhuj Varman,varman_chaturbhuj@daniel-hand.test,Quasi ut nihil. Excepturi quo vel. Et quisquam delectus.
179857,267328,Bhagirathi Tandon,bhagirathi_tandon@homenick.example,Aut sunt sint. Blanditiis aut dolore. Nam cum reprehenderit. Quia quisquam odit.
179856,267326,Bhasvan Kapoor,kapoor_bhasvan@wehner-greenfelder.test,Aliquid atque voluptatem. Officiis molestiae rerum. Est officia velit.
179855,267326,Shashi Nayar Jr.,nayar_shashi_jr@west.example,Eveniet laboriosam repellat. Dicta ratione qui.
179854,267325,Chandramani Khatri,chandramani_khatri@bernier.example,Enim consequatur deleniti. Beatae id iure. Dolor aut explicabo.
179853,267324,Meena Dwivedi,meena_dwivedi@grimes.example,Libero maxime expedita. Dolor voluptate quibusdam.
179852,267324,Gatik Khan,gatik_khan@reinger.test,Fugit unde incidunt. Odio nemo deleniti. Assumenda quia sapiente.
179851,267323,Sumitra Rana,sumitra_rana@mitchell.test,Odio atque et.
179850,267323,Dayaanidhi Kocchar LLD,dayaanidhi_kocchar_lld@conroy.test,Ipsam molestiae qui. Dolorem sed odit. Aspernatur ut veritatis.
179849,267321,Agniprava Joshi,joshi_agniprava@gerhold.example,Aut quia veniam. Voluptatem quo possimus.
179848,267320,Kali Kaniyar,kaniyar_kali@denesik.test,Ab repellat quia.
179847,267320,Ghanashyam Dwivedi,dwivedi_ghanashyam@kuhn.example,Soluta distinctio magnam. Est quia qui. Qui non et.
179846,267319,Amb. Naval Mukhopadhyay,amb_naval_mukhopadhyay@dietrich.example,Esse doloribus sapiente. Et corrupti qui. Nostrum blanditiis in. Provident impedit recusandae.
179845,267318,Giriraaj Varman,varman_giriraaj@bernier.example,Ea quidem quae. Ut quod fuga. Rerum rerum magnam.
179844,267318,Chidambaram Talwar,talwar_chidambaram@crona.test,Sint odit dolores.
179843,267315,Gangesh Singh,singh_gangesh@ankunding.example,Pariatur consequatur nobis. Aut cum repellendus. Delectus ipsam eos. Sapiente sint rerum.
179842,267315,Chapala Chattopadhyay,chattopadhyay_chapala@prosacco.test,Reprehenderit et alias. Aliquam est qui. Omnis natus numquam. Quos et itaque.
179841,267314,Anuja Shah,shah_anuja@huels-bartoletti.example,Et eveniet rerum. Similique expedita aperiam. Id est ipsam. Ut harum esse.
179840,267314,Gandharv Gill DVM,gandharv_gill_dvm@erdman.example,Ad excepturi aliquid.
179839,267313,Karunanidhi Menon DDS,karunanidhi_dds_menon@okeefe.example,Reiciendis numquam consequatur.
179838,267313,Minakshi Jha,minakshi_jha@runolfsson-schiller.test,Consequatur consequatur exercitationem.
179837,267309,Samir Dubashi MD,samir_md_dubashi@rowe-kirlin.example,Ut quasi omnis. Et dignissimos fuga. In sit voluptatem. Quos quisquam voluptates.
179836,267309,Bhardwaj Khatri,bhardwaj_khatri@wilkinson-powlowski.test,Consequatur accusamus ut. Incidunt dolore aut.
179835,267308,Bharat Kapoor,kapoor_bharat@balistreri-kuhlman.test,Repellendus et ipsum. Aut sint veritatis. Sunt animi distinctio. Et consequatur omnis.
179834,267308,Gov. Sloka Jain,jain_sloka_gov@orn.test,Ut sed et. Voluptatibus est atque.
179833,267306,Padma Arora,padma_arora@grady-osinski.example,Ullam similique velit. Doloribus et et.
179832,267303,Esha Pandey,pandey_esha@waters-oberbrunner.example,Nihil non rem. Quo et praesentium.
179831,267302,Rajinder Dhawan,rajinder_dhawan@roberts-rohan.test,Velit impedit deleniti. Voluptatem impedit accusamus. Ut quia blanditiis. Dolore magnam delectus.
179830,267302,Rep. Aasa Kaniyar,aasa_rep_kaniyar@waters.test,Eaque ipsam quidem.
179829,267299,Prof. Mani Nambeesan,mani_prof_nambeesan@waters-goodwin.test,Quam rerum voluptatem. Aliquid similique architecto. Nam est et.
179828,267299,Devasree Menon Jr.,devasree_jr_menon@friesen.test,Eos eum qui.
179827,267297,Bhadran Joshi,bhadran_joshi@stracke.test,Autem quisquam ab.
179826,267297,Dhatri Chopra,dhatri_chopra@runte-graham.test,In molestiae consequatur. Aut eligendi et.
179825,267290,Shreyashi Menon,menon_shreyashi@mertz.test,Facilis molestias vitae. Sint voluptates assumenda. Alias aut voluptatem.
179824,267290,Menka Kaur MD,kaur_menka_md@wolff-reilly.example,Ea inventore dolor. Hic nihil aliquam. Pariatur laborum molestias.
179823,267289,Sharda Guneta,guneta_sharda@bechtelar.test,Sequi dolorem voluptatem. Et quidem placeat. Hic omnis aut. Perferendis dolorem sed.
179822,267287,Shrishti Mukhopadhyay,mukhopadhyay_shrishti@hermann.example,Sint voluptate sunt. Aliquid recusandae exercitationem. Ipsum voluptatem quisquam. Dignissimos repellendus qui.
179821,267286,Dandak Gandhi MD,gandhi_md_dandak@bayer.test,Nesciunt iure id. Ut qui nihil. Ut animi facilis.
179820,267286,Chaturaanan Mehrotra,chaturaanan_mehrotra@turcotte.test,Est et vel. Error vel et. Et eveniet numquam.
179819,267285,Msgr. Soma Embranthiri,msgr_embranthiri_soma@schultz.test,Deleniti recusandae inventore. Aspernatur unde ut. Voluptas vero vel. At dolorum illo.
179818,267284,Mandakini Kaul,kaul_mandakini@barrows.test,Modi eligendi quidem. Omnis quia quis. Nihil doloremque culpa. Quia molestias a.
179817,267284,Swarnalata Verma,verma_swarnalata@hammes.example,Quibusdam quia eum. Quaerat neque eum.
179816,267283,Ananta Bhattathiri,ananta_bhattathiri@reichel.example,Asperiores quia maxime. Velit adipisci possimus.
179815,267278,Bala Bharadwaj JD,jd_bala_bharadwaj@moen-borer.test,At id iusto.
179814,267278,Balagovind Bhattathiri,balagovind_bhattathiri@stiedemann.test,Qui consequatur inventore. Voluptatem quibusdam similique.
179813,267277,Amodini Trivedi Ret.,ret_amodini_trivedi@barton.example,Aperiam provident quasi. Natus cumque impedit.
179812,267277,Pushti Ganaka,pushti_ganaka@dach-pfeffer.test,Sit omnis sunt. Similique est incidunt. Ut eligendi ab.
179811,267276,Mandakini Dwivedi CPA,dwivedi_mandakini_cpa@blanda.example,Reiciendis aut occaecati. Facere odio sunt.
179810,267276,Gandharva Nayar,nayar_gandharva@hyatt-schroeder.example,Qui illo rem.
179809,267275,Ganesh Pothuvaal PhD,pothuvaal_phd_ganesh@dooley.test,Earum sunt iste. Dicta voluptates consequuntur.
179808,267273,Miss Chinmayananda Desai,chinmayananda_miss_desai@pfeffer.test,Qui perspiciatis quas.
179807,267270,Trilochan Patel,patel_trilochan@sipes.example,Aut itaque iusto. Sapiente quasi et. Dicta quasi consequuntur. Perspiciatis incidunt sit.
179806,267269,Anilaabh Prajapat,anilaabh_prajapat@kuvalis.example,Amet est inventore. Repellat ut maxime. Velit sint autem. Dolor veniam cumque.
179805,267269,Tanushree Kakkar,kakkar_tanushree@schuster.example,Corporis officiis sed.
179804,267267,Rohan Jha,rohan_jha@schmitt.test,Neque inventore sequi. Tempore in sed.
