id,post_id,name,email,body
182382,269243,Gemine Somayaji JD,gemine_somayaji_jd@beahan-jacobson.test,Est quidem vitae. Unde voluptas occaecati. Quos voluptatem et.
182381,269240,Vedanga Varman,vedanga_varman@lubowitz.test,Delectus vel sunt. Molestiae ut itaque. Dolorem reiciendis beatae. Ut sunt assumenda.
182380,269240,Amogh Bhattacharya,amogh_bhattacharya@mcglynn-shields.example,Quas nemo aut. Nesciunt maxime laudantium. Repudiandae nobis alias. Qui sint est.
182379,269239,Rageswari Marar,marar_rageswari@turner.test,Sunt architecto quaerat.
182378,269239,Chidambaram Dutta,chidambaram_dutta@pacocha.example,Debitis quod consequatur. Qui ut repellendus.
180693,268152,Vimal Mehrotra,mehrotra_vimal@gutmann-rutherford.test,Beatae nihil ut. Asperiores mollitia excepturi.
180692,268152,Gautami Talwar,gautami_talwar@greenholt.test,Hic eum quis. Officiis aut asperiores.
180687,268144,Gauraang Mehra,mehra_gauraang@morar.example,Adipisci optio quia. Fugiat hic ut. Harum nam aut.
180686,268144,Trilochan Chattopadhyay,trilochan_chattopadhyay@dibbert-greenholt.example,Eius libero aut.
180683,268139,Lakshminath Pillai,lakshminath_pillai@mraz-emmerich.example,Est consequatur reiciendis. Repellat quia recusandae. Fugit maiores voluptates.
180682,268136,Tarun Pandey,pandey_tarun@gutmann.test,Enim blanditiis molestias. Ratione nulla ducimus. Et similique nesciunt. Iusto dicta aut.
180681,268134,Geetanjali Nehru MD,md_geetanjali_nehru@cummerata.example,Suscipit ea delectus. Qui nobis sed. Perspiciatis quis sit.
180680,268134,Divjot Somayaji,somayaji_divjot@bruen-frami.example,Dolores sint vero. Voluptatem distinctio et.
180679,268132,Brajesh Nambeesan,nambeesan_brajesh@oreilly-boehm.test,Adipisci qui eveniet. Dolor aliquam ut. Consequatur veniam architecto.
180678,268132,Vaijayanti Namboothiri,vaijayanti_namboothiri@mayert.test,Unde dolorum odio. Commodi magni officiis.
180677,268131,Bishnu Gowda,gowda_bishnu@kub.test,Ut sed quod.
180676,268131,Subodh Dubashi,dubashi_subodh@dicki.test,Aspernatur temporibus consequatur. Rem porro quia.
180675,268130,Bhaanumati Joshi,joshi_bhaanumati@cormier.test,Qui fugit enim. Consequatur voluptatibus suscipit. Inventore et veniam. At et ad.
180674,268130,Tanushri Somayaji,tanushri_somayaji@hane.example,Magni repellendus ex.
180673,268128,Jitendra Somayaji,somayaji_jitendra@schimmel-stracke.test,Voluptas non est. Rem atque aut.
180672,268128,Chandraayan Asan DO,chandraayan_asan_do@block.example,Reiciendis facilis praesentium. Et impedit doloribus. Maxime veritatis dolor.
180671,268126,The Hon. Gautam Khatri,gautam_hon_the_khatri@robel.example,Voluptas nostrum et. Officiis debitis in. Assumenda consequatur libero. Et voluptas laborum.
180670,268124,Brajendra Varma VM,varma_brajendra_vm@blick-heidenreich.test,Voluptatibus perferendis quod. Quod tempora voluptate.
180669,268124,Gorakhnath Devar,devar_gorakhnath@yost-trantow.test,Repudiandae consequatur aspernatur. Vel magni officia. Sed aut atque.
180668,268123,Abhirath Mishra,abhirath_mishra@hettinger-jones.example,Qui numquam quia. Quia ut harum.
180667,268122,The Hon. Chatura Patel,hon_the_patel_chatura@hartmann.test,Non eligendi et.
180666,268121,Prof. Shreya Verma,shreya_verma_prof@herzog-rodriguez.example,Rem quis et. Maxime velit repudiandae. In et aut. Sint qui vel.
180665,268121,Atmanand Verma CPA,cpa_atmanand_verma@cole-kertzmann.test,Qui fugit sint. Voluptatum rem nemo.
180664,268119,Rep. Chandraprabha Prajapat,chandraprabha_prajapat_rep@rolfson.test,Sed dicta qui. Nemo optio consequuntur. Minus repellat veritatis. Sint rerum sed.
180663,268119,Prof. Mohinder Tandon,tandon_prof_mohinder@bergnaum-connelly.example,Ut aut voluptatem.
180662,268118,Gov. Ajit Singh,ajit_singh_gov@roob.example,Ut qui pariatur. Natus qui modi. Necessitatibus non odio. Aut et iusto.
180661,268117,Bhargavi Pilla,bhargavi_pilla@renner.example,Hic et tempora. Quia iure ex. Ut voluptas labore. Rerum dicta voluptas.
180660,268117,Buddhana Malik,malik_buddhana@jast.test,Quis ipsum eveniet. Voluptates consequuntur ut.
180659,268116,Ekdant Panicker,ekdant_panicker@lockman.test,At saepe est. Velit illum et.
180658,268115,Akshainie Shukla,akshainie_shukla@toy.test,Ex voluptatem consequatur.
180657,268114,Susheel Rana,rana_susheel@kris-thompson.example,Esse culpa eveniet.
180656,268112,Mr. Baalagopaal Chopra,chopra_baalagopaal_mr@rogahn.example,Accusantium dolorum veniam.
180655,268110,Jahnu Somayaji,jahnu_somayaji@gerlach.example,Repellendus quod nemo.
180654,268110,Kannan Chaturvedi,chaturvedi_kannan@gorczany-barton.test,Blanditiis unde nostrum. Omnis qui laborum. Dolorem qui quidem. Voluptas fuga voluptas.
180653,268107,Mr. Shiv Mahajan,shiv_mahajan_mr@reynolds-heaney.test,Est rerum iste. Saepe ea sit. Cumque et odit. Dolor impedit commodi.
180652,268106,Chandan Dwivedi,dwivedi_chandan@ruecker.example,Voluptatem perferendis nobis. Ducimus ut quia.
180651,268106,Opaline Kakkar,kakkar_opaline@weissnat.example,Dolorem amet eos. Aut dolor quidem.
180650,268105,Bala Tagore,bala_tagore@larson.example,Voluptatem debitis voluptates. Labore amet sed. Quo officia maxime.
180649,268105,Mukesh Nayar II,nayar_ii_mukesh@moen.example,Repudiandae ab consequatur. Quae ipsa debitis.
180648,268102,Aatreya Pillai,pillai_aatreya@quitzon.example,Placeat enim dolorem. Nulla libero ipsum. Dolorem aut voluptatibus.
180647,268101,Ghanshyam Namboothiri,ghanshyam_namboothiri@lynch.test,At non aperiam. Qui in occaecati. Voluptatibus soluta quasi. Soluta autem aut.
180646,268100,Tej Patil,tej_patil@ortiz.test,Placeat nemo et. Ea aperiam illo. Quia sit praesentium. Explicabo et aliquam.
180645,268099,Chandramani Bhattacharya,chandramani_bhattacharya@schroeder.test,Qui neque et.
180644,268099,Gov. Aadi Jain,jain_aadi_gov@jacobi.test,Totam recusandae cum. Suscipit vel doloribus. Tempora consequuntur voluptatum. Aut sit aperiam.
180643,268097,Suma Bharadwaj,bharadwaj_suma@cronin.test,Et architecto ratione. Natus consectetur optio. Tempore deleniti cumque.
180642,268097,Malati Gowda,gowda_malati@mann.test,Animi et qui.
180641,268095,Agnivesh Dutta,agnivesh_dutta@vandervort-farrell.example,Molestiae eos quisquam. Fugiat illum minima.
180640,268094,Mahendra Patil V,v_mahendra_patil@lemke-robel.test,Sunt quos ut.
180639,268094,Amb. Opalina Johar,johar_opalina_amb@harris.example,Optio autem esse.
180638,268091,Mrs. Bhadrak Mehrotra,mehrotra_mrs_bhadrak@watsica-lindgren.example,Odio natus in. Quis sit nobis.
180637,268091,Tara Dubashi LLD,dubashi_tara_lld@nolan-haag.test,Rem est quis. Rerum tempora reiciendis. Dolores aut vel. Voluptate velit commodi.
180636,268087,Kamalesh Singh,kamalesh_singh@thompson.test,Et repellendus voluptatem. Est aut vel. Natus aut repellat. Provident est sapiente.
180635,268087,Amb. Agrata Kaul,agrata_kaul_amb@muller-hintz.test,Voluptatem voluptatem neque. Fugiat ipsam facilis. Dolorum est quo.
180634,268086,Mr. Jagadish Chattopadhyay,chattopadhyay_jagadish_mr@marquardt.test,Illum neque omnis. Quis laboriosam dolor. Nam officia eius.
180633,268086,Chandrakin Asan,chandrakin_asan@legros-padberg.example,Ut cupiditate architecto. Et officia sint. Doloremque repellendus est. Neque quo vel.
180632,268085,Tara Kaur,tara_kaur@quitzon-schamberger.test,Vero quo voluptatibus. Corrupti repudiandae accusantium. Voluptatem quia quis.
180631,268085,Ujjawal Nehru VM,ujjawal_vm_nehru@crist-vonrueden.example,Eveniet non unde. Qui sit perspiciatis.
180627,268082,Gaurang Bhattathiri,gaurang_bhattathiri@wolff.example,Aut cum placeat. Eum sunt exercitationem.
180626,268080,Amb. Deeksha Ganaka,ganaka_amb_deeksha@conn-renner.test,Ipsum eius aut. Est excepturi non. Eveniet perferendis vitae. Porro rerum perspiciatis.
180625,268080,Vrund Desai VM,vrund_vm_desai@dicki-hamill.test,Aut similique necessitatibus. Vero non veniam. Ex sunt nostrum.
180624,268078,Narendra Kaur,narendra_kaur@koch.example,Non similique ab. Est repellendus est. Fuga necessitatibus cupiditate. Facere id expedita.
180623,268078,Chandrakin Mukhopadhyay Esq.,mukhopadhyay_esq_chandrakin@tremblay-roberts.test,Sapiente distinctio consectetur. Sit et laboriosam.
180622,268077,Birjesh Singh,birjesh_singh@haag.example,Saepe et aliquam. Quis fugiat laboriosam. Voluptatum ea ducimus.
180621,268077,Enakshi Kaniyar,enakshi_kaniyar@dietrich-ward.example,Rem vitae fugiat. Culpa molestiae non. Quia eos et.
180620,268076,Som Embranthiri,som_embranthiri@bashirian.test,Vel velit sint. Quia ullam quis. Et aut quaerat. Corporis illo magnam.
180619,268076,Kamala Kocchar,kamala_kocchar@upton.test,Dolorem iusto minus. Et enim architecto. Beatae quas id.
180618,268075,Rupinder Malik,rupinder_malik@swaniawski.test,Veritatis tempora consequatur. Optio id dolores. Numquam corrupti odio. Dolor non temporibus.
180617,268074,Rakesh Devar,rakesh_devar@littel-koepp.test,Rerum harum aperiam. Corporis ut aliquid. Iusto vel ratione. Quas et unde.
180616,268073,Miss Chakradhar Nayar,chakradhar_nayar_miss@legros-prosacco.test,Ullam quod saepe. Ex cum omnis.
180615,268070,Chatur Desai Jr.,desai_chatur_jr@kunze-rippin.example,Tempore ex aperiam.
180614,268069,Rev. Aanand Nair,aanand_nair_rev@mitchell.test,Vel quis aspernatur.
180613,268069,Dhruv Nayar,dhruv_nayar@kilback.example,Aut eaque voluptates. Consequatur a minus. Quasi alias recusandae.
180612,268067,Vedanga Kaniyar,kaniyar_vedanga@schroeder.example,Reprehenderit facere culpa.
180611,268067,Meenakshi Naik,naik_meenakshi@koelpin.example,Itaque minima autem.
180610,268066,Divaakar Achari,achari_divaakar@breitenberg.test,Distinctio et nam. Est quidem non. Ut possimus odit.
180609,268066,Sujata Talwar PhD,talwar_phd_sujata@wilderman.test,Cupiditate aut dolores.
180608,268065,Deependra Dhawan,deependra_dhawan@doyle.test,Dolor est nulla. Fugiat aliquid dolorem.
180607,268063,Puneet Verma,puneet_verma@graham.example,Neque omnis aut. Voluptatem rerum voluptas. Eius minima amet.
180606,268061,Bhagvan Johar,bhagvan_johar@trantow.test,A non impedit.
180605,268061,Abhaya Kapoor DC,abhaya_kapoor_dc@considine.example,Iusto sit laboriosam. Sint aut quaerat. Incidunt dolore provident.
180604,268060,Shwet Shukla,shukla_shwet@morar.test,Officia ea doloremque. Vel similique vero.
180603,268058,Chakravarti Bhattathiri,chakravarti_bhattathiri@reilly.test,Sit facilis quaerat.
180602,268057,Padma Somayaji,somayaji_padma@baumbach.test,Error numquam iure.
180601,268057,Miss Dayaamay Jha,miss_dayaamay_jha@hayes.test,Optio sit animi.
180600,268056,Udai Kaur,udai_kaur@lowe.example,Provident ut eius. Sit dolor omnis. Nam numquam quia.
180599,268056,Javas Varman,varman_javas@abshire.test,Quia earum quia. Officiis sed eum. Ut officiis aut.
180598,268055,Priya Rana DVM,rana_dvm_priya@gibson-mckenzie.test,Id voluptates rem. Quos quia quod. Laborum dolores nulla. Dolore inventore placeat.
180597,268055,Triloki Nath Nair,nath_nair_triloki@renner.example,Laborum porro eos. Eveniet ab dignissimos. Tempore sit aperiam. Magni sit provident.
180596,268054,Bhudeva Jha DVM,jha_dvm_bhudeva@berge-murphy.test,Qui et dignissimos. Delectus modi ea.
180595,268054,Dhanadeepa Ahluwalia,ahluwalia_dhanadeepa@herzog.example,Ipsum ad non.
180594,268051,Dron Pothuvaal,pothuvaal_dron@metz-okeefe.example,Similique magni maxime. A eaque odio.
180593,268051,Nanda Bharadwaj,nanda_bharadwaj@schoen-hermann.example,Molestiae itaque cumque. Incidunt labore nihil.
180592,268049,Bhudeva Achari,achari_bhudeva@bahringer.example,Cumque sed minima. Dolore nihil enim. Quos ducimus porro.
180591,268048,Bandhul Malik II,bandhul_malik_ii@braun-corwin.example,Consequuntur aut consequatur. Saepe ipsum error.
180590,268048,Ms. Nimit Namboothiri,namboothiri_ms_nimit@turner.test,Consequatur deleniti inventore. Voluptatem sint et. Et ea odit.
180589,268046,Sloka Deshpande,deshpande_sloka@toy.example,Quod dolore consequuntur.
180588,268046,Ms. Aayushmaan Mehra,aayushmaan_ms_mehra@bode-crona.example,Qui laudantium sit.
180587,268045,Rep. Suresh Kapoor,suresh_rep_kapoor@murray.example,Rem magni aut. Voluptas sit aliquid. Unde et saepe. Ipsum aut esse.
180586,268045,Deb Rana,rana_deb@west.example,Ducimus sunt rerum.
180585,268043,Vaidehi Varma,vaidehi_varma@kovacek.example,Corporis non facere.
180584,268040,Dinkar Johar,dinkar_johar@schuppe.test,Quae vero asperiores.
180583,268039,Priya Bandopadhyay DDS,dds_priya_bandopadhyay@hahn.example,Velit minima totam. Itaque consequatur tenetur. Expedita dolorum sequi. Eius autem est.
180582,268037,Rep. Manoj Pillai,rep_manoj_pillai@okuneva.example,Officia assumenda alias. Iste ad voluptatibus.
180581,268034,Aryan Rana Sr.,aryan_sr_rana@funk.test,Fugiat ullam unde. Ex occaecati veniam.
180580,268033,Msgr. Digambar Arora,msgr_digambar_arora@funk.test,Eaque ut doloremque. Rerum at incidunt. Et facilis voluptatibus. Culpa maxime ipsa.
180579,268033,Agasti Gowda,gowda_agasti@huels-jacobs.example,Quis aliquid qui.
180578,268031,Aatmaja Sinha,aatmaja_sinha@sipes-spencer.test,Et nobis in. Et illum soluta. Delectus deleniti voluptatum. Rem nemo quasi.
180577,268031,Bhushit Pandey,bhushit_pandey@schiller.test,Dolores et expedita. Et qui reprehenderit. Tempore illum non.
180576,268029,Nimit Somayaji,nimit_somayaji@leffler.example,Nesciunt nulla rerum.
180575,268029,Chandrakala Pandey,chandrakala_pandey@hickle.example,Voluptatibus omnis enim.
180574,268028,Surya Bandopadhyay I,surya_bandopadhyay_i@herman.example,Repellendus rerum labore.
180573,268028,Bhudeva Bhattathiri,bhudeva_bhattathiri@jast-cruickshank.test,Dolorum totam adipisci. Debitis totam illo. Maiores esse dolores. Sint earum magni.
180572,268027,Brahmanandam Varman Sr.,varman_sr_brahmanandam@fahey.example,Expedita est et. Porro ducimus omnis. Ipsa qui eaque. Sit et odit.
180571,268026,Gaurang Devar,gaurang_devar@mraz-bergstrom.example,Magni veritatis officiis. Vero quia sit. Vitae et laudantium. Inventore recusandae aspernatur.
180570,268026,Charak Ganaka,ganaka_charak@botsford-ritchie.example,Incidunt illum officia. Quia ut dolore. Enim minima impedit. Asperiores et dolorem.
180569,268023,Vedang Ahuja,ahuja_vedang@ankunding.test,Nihil vitae sint. Vel unde amet. Aut eum et.
180568,268023,Datta Iyer,datta_iyer@runte.test,Placeat dicta dolore. Unde laboriosam mollitia. Eos consequatur quis.
180567,268022,Miss Deeptimoyee Asan,deeptimoyee_asan_miss@treutel.test,Consequatur odit omnis. Sit debitis commodi.
180566,268021,Nawal Guha Jr.,jr_guha_nawal@wolff-hilpert.test,Voluptas aut porro. Beatae ipsam blanditiis. Fuga aliquam impedit.
180565,268021,Rep. Aruna Ganaka,rep_ganaka_aruna@mohr.example,Accusantium consequuntur voluptatem. Qui doloremque est. Exercitationem natus consequatur.
180564,268019,Aruna Adiga,aruna_adiga@johnson.example,Odit non nihil. Cupiditate fuga autem. Laboriosam asperiores eius. A quibusdam quis.
180563,268018,Dwaipayan Tagore IV,dwaipayan_tagore_iv@pacocha.example,Ratione sequi consequuntur.
180562,268017,Amb. Laal Singh,amb_singh_laal@langosh.test,Dolores sit quas. Ex vel voluptates. Nihil fugit qui.
180561,268016,Aanand Abbott,abbott_aanand@gerhold.example,Ea impedit soluta. Rerum odit fugit.
180560,268016,Avani Kaniyar,kaniyar_avani@nitzsche-oconnell.test,Esse illo modi. Rem quas alias. Amet laborum quis.
180559,268015,Siddhi Ahluwalia,siddhi_ahluwalia@flatley.test,Hic maxime enim.
180558,268015,Mrs. Dron Devar,dron_devar_mrs@ernser-kassulke.test,Occaecati mollitia in. Sit dolores alias. Facere nisi recusandae. Reprehenderit voluptatem et.
180557,268014,The Hon. Sushil Ahuja,ahuja_hon_the_sushil@considine.test,Amet ut similique. Quidem accusamus est. Placeat culpa labore. Alias corrupti modi.
180556,268013,Balagovind Bhattacharya,bhattacharya_balagovind@schmeler-reynolds.test,Ab et et. Aut omnis consequatur. Saepe aut omnis.
180555,268013,Chinmayananda Verma VM,vm_chinmayananda_verma@ohara-strosin.example,In eaque assumenda. Saepe aperiam id. Omnis qui consequuntur. Nihil vero saepe.
180554,268012,Daksha Butt,butt_daksha@kiehn.test,Incidunt modi quae. Animi possimus aut.
180553,268010,Agniprava Kocchar,agniprava_kocchar@smith-wisozk.example,Facilis asperiores quisquam. Et eum adipisci.
180552,268010,Omana Chaturvedi,chaturvedi_omana@leuschke.example,Dolores deserunt suscipit. Dicta omnis eos. Maxime modi perferendis. Qui voluptatem quia.
180548,268007,Sunita Verma,verma_sunita@heathcote.test,Et ea consequatur. Neque sit voluptatem. Porro quidem magni. Dicta ipsum eos.
180547,268007,Manik Dubashi,manik_dubashi@schulist.example,Ducimus cumque cum. Voluptatem veritatis in. Eaque cum accusamus.
180546,268006,Chinmayananda Agarwal,chinmayananda_agarwal@bashirian-williamson.example,Nemo et expedita.
180545,268006,Navin Joshi,navin_joshi@heaney.example,Et dolores voluptas.
180544,268004,Narayan Desai,narayan_desai@aufderhar.example,Enim voluptate sed.
180543,268004,Deeptimayee Iyer DC,deeptimayee_dc_iyer@cormier-ebert.test,Quas quo iusto. Vel distinctio vero. Voluptatem doloribus eveniet.
180542,268002,Amb. Tanirika Mahajan,tanirika_amb_mahajan@schiller.example,Et sint nihil.
180541,267999,The Hon. Vaishno Butt,hon_butt_the_vaishno@kihn.test,Aut corporis distinctio.
180540,267999,Kashyap Malik,kashyap_malik@ebert-morissette.example,Voluptas voluptas nam. Exercitationem tempora voluptatum.
180539,267998,Sarala Gandhi,sarala_gandhi@bernier.test,Illum eveniet dicta. Illum sequi dolor.
180538,267997,Rev. Triloki Nath Nair,nath_rev_nair_triloki@crooks-weber.test,Sit est et. Asperiores dolores ut. Nam laudantium ipsum.
180537,267996,Dhana Singh III,dhana_iii_singh@yost-thompson.test,Qui similique nostrum. Et eos rerum.
180536,267996,Ojaswini Chattopadhyay,ojaswini_chattopadhyay@kirlin.test,Ab ratione explicabo. Culpa nulla quaerat. Sint sed harum.
180535,267991,Chitrangada Pilla,chitrangada_pilla@bins.test,Sed sint nostrum. Quaerat laboriosam occaecati. Consequatur et ratione. Voluptatem dolore sed.
180534,267991,Dwaipayan Marar,dwaipayan_marar@doyle.test,Omnis cupiditate quas. Modi harum exercitationem.
180533,267990,Fr. Hamsini Iyer,hamsini_fr_iyer@kirlin-towne.example,Corporis porro voluptas. Molestiae reiciendis sit.
180532,267990,Bhooshan Dhawan,dhawan_bhooshan@schmidt-mitchell.test,Reiciendis accusantium autem. Sapiente aut nostrum.
180531,267989,Dandak Desai,desai_dandak@medhurst-will.test,Atque dicta et. Quibusdam cupiditate enim. Natus qui sit. Et ipsa at.
180530,267988,Devdan Nambeesan VM,nambeesan_devdan_vm@batz.test,Voluptatem perferendis minus. Debitis deserunt odio. Veniam non ipsum. Aliquam eos tenetur.
180529,267986,Gudakesa Menon,menon_gudakesa@stokes-ruecker.test,Ex atque ipsum. Ea labore minus.
180528,267985,Rameshwar Tagore,rameshwar_tagore@gibson.test,Laborum autem error. Temporibus quae adipisci.
180527,267982,Bankim Adiga,adiga_bankim@franecki.example,Laudantium molestias vero. Perferendis dolorem incidunt.
180526,267980,Ekdant Asan,ekdant_asan@smith.example,Sequi eligendi reiciendis. Quae modi deserunt.
180525,267980,Ghanaanand Namboothiri,ghanaanand_namboothiri@rath.test,Fuga ut praesentium. Libero fugiat vitae.
180524,267979,Chandraswaroopa Gupta,chandraswaroopa_gupta@howe.test,Dolores illo dolor. Totam aperiam quidem.
180523,267979,Mr. Shrishti Butt,mr_butt_shrishti@conroy.test,Ut et numquam.
180522,267977,Achintya Tagore,tagore_achintya@dach-gorczany.example,Asperiores recusandae vel.
180521,267975,Tanushri Kakkar,kakkar_tanushri@leuschke-yost.test,Ab iusto consequatur. Quia dolor ex.
180520,267975,Ganesh Namboothiri DDS,namboothiri_ganesh_dds@swift-hudson.test,Et reprehenderit veniam. Magnam voluptate deserunt. Velit commodi iure.
180519,267974,Chakrika Dhawan MD,dhawan_md_chakrika@zboncak-wehner.example,Qui quos sed. Quam nisi ab. Autem odio fugit.
180518,267971,Ms. Daevi Gowda,gowda_ms_daevi@okuneva.test,Illo eveniet atque. Ut architecto placeat. Ipsam a perferendis. Aut dolores quia.
180517,267969,Girija Deshpande,deshpande_girija@gibson.test,Debitis vero et. Qui dolores veniam.
180516,267969,Shubha Ganaka,ganaka_shubha@yundt-beer.test,Ipsa enim iste.
180515,267968,Shresthi Joshi,joshi_shresthi@luettgen.test,Qui est ullam. Exercitationem aperiam eos. Sit ut voluptatibus.
180514,267965,Vinay Varma,varma_vinay@bednar-smith.test,Quas libero architecto. Ea beatae qui. Blanditiis harum cumque. Voluptatem eos voluptatem.
180513,267965,Basanti Gowda,basanti_gowda@altenwerth.example,In praesentium at.
180512,267964,Dhanesh Khanna DO,do_dhanesh_khanna@powlowski.example,Delectus voluptatum amet. Voluptas distinctio ipsam. Natus voluptatum beatae.
180511,267964,Sukanya Panicker CPA,panicker_cpa_sukanya@mitchell-konopelski.example,Odit itaque minus. Officiis qui totam.
180510,267963,Bilva Achari,bilva_achari@dubuque-feeney.example,Cum et sit. Tempora et quia. Id sed magni. Laborum eos similique.
180509,267963,Bhupati Gowda,gowda_bhupati@denesik-boehm.test,Consequuntur impedit nulla. Quis ea voluptatem. Placeat sed earum.
180508,267960,Aasha Mahajan,aasha_mahajan@green.test,Culpa ex aut.
180507,267957,Darshwana Menon,menon_darshwana@bartoletti.example,Illo dolore ut. Dolor rerum sed.
180506,267957,Kirti Pandey,kirti_pandey@satterfield.example,Blanditiis rem quia. In ea aperiam. Voluptas non eius. Sed quae dignissimos.
180505,267956,Devika Singh,singh_devika@pfeffer-mertz.example,Ratione est eum. Quia dicta adipisci. Molestiae eos quam.
180504,267956,Chaturaanan Guneta,chaturaanan_guneta@hagenes.test,Rem id et. Porro quia debitis.
180503,267955,Mrs. Ekaksh Abbott,ekaksh_abbott_mrs@gleichner-hackett.example,Modi sed sunt.
180502,267955,Birjesh Mehrotra,mehrotra_birjesh@heidenreich.test,Ullam temporibus vel. Consequuntur sit non. Est sed repudiandae. Asperiores deleniti eaque.
180501,267954,Aarya Dhawan,dhawan_aarya@dibbert.example,Maxime animi consectetur. Sapiente fugit vitae. Vel adipisci fuga.
180500,267952,Deeptimayee Pothuvaal,deeptimayee_pothuvaal@schneider-von.test,Mollitia eos impedit. Iste perferendis ab. Aut fugit blanditiis. Quaerat reprehenderit vitae.
180499,267949,Lal Tandon,tandon_lal@wyman-stroman.test,In et fuga.
180498,267949,Mangalya Singh,mangalya_singh@jacobson.example,Animi qui autem. Consequatur molestiae rerum.
180497,267948,Diptendu Chopra,chopra_diptendu@collier.test,Tempora occaecati velit. Earum quia labore. Earum eum eaque. Autem reprehenderit dignissimos.
180496,267945,Deepankar Kapoor,kapoor_deepankar@hintz.test,Magni nobis quos. Ut fugiat et. Ut voluptas porro. Numquam dolorum et.
180495,267944,Charuvrat Varman,charuvrat_varman@buckridge.test,Quos eum harum. Tenetur facilis error. Et in explicabo.
180494,267944,Preity Naik,naik_preity@lakin.test,Voluptas dolor eveniet.
180493,267943,Dr. Agniprava Dwivedi,agniprava_dr_dwivedi@mills.test,Aliquid libero accusantium. Quia occaecati labore. Est soluta et. Voluptas consequatur dolorem.
180492,267942,Deven Iyer,deven_iyer@rolfson.example,Ut dolor laborum.
180491,267941,Manoj Trivedi,trivedi_manoj@cormier.test,Molestias temporibus sed. Et odio est. Nisi in accusantium. Aut est inventore.
180490,267940,Paramartha Gupta,gupta_paramartha@rath.example,Saepe nihil vel. Eaque deserunt dolorem. Dolor nisi non. Magnam aut qui.
180489,267940,Dhyaneshwar Verma,dhyaneshwar_verma@windler.test,Dolorem laborum et. Optio sint minima. In et quo.
180488,267939,Tara Deshpande MD,tara_md_deshpande@robel.test,Molestias qui at. Quia sit voluptate. Pariatur vel recusandae.
180487,267939,Bhuvaneshwar Mishra,mishra_bhuvaneshwar@bosco.example,Sint ut voluptatem. Tempore eius officiis.
180486,267938,Giri Nayar,nayar_giri@skiles-hills.test,Reiciendis sed eligendi.
180485,267938,Suresh Embranthiri,suresh_embranthiri@murray.example,Esse sit quod. Quia labore eum. At est ullam. Repellat voluptas architecto.
180484,267937,Pramila Dwivedi,pramila_dwivedi@veum.example,Error quas alias.
180483,267937,Asha Malik,malik_asha@lind.example,Dolore ea aut. Veritatis quam ab. Et vel itaque. Delectus possimus reprehenderit.
180482,267935,Adwitiya Dutta,dutta_adwitiya@fisher.example,Molestias magnam neque.
180481,267934,Bhudev Bhattacharya,bhattacharya_bhudev@bergstrom-emmerich.example,Praesentium magnam consequatur. Voluptatem debitis placeat.
180480,267930,Gautam Embranthiri Jr.,gautam_embranthiri_jr@gleichner.example,Veniam occaecati recusandae. Voluptatum sit eligendi. Animi harum voluptas.
180479,267930,Goswamee Mishra,mishra_goswamee@smitham.example,Reiciendis non voluptates. Voluptate ipsum eligendi. Ab est reprehenderit. Ipsum corrupti tempore.
180478,267929,Ghanshyam Talwar,ghanshyam_talwar@wyman.example,Voluptatibus beatae odio. Maiores modi dignissimos. Minus est et.
180477,267929,Gayatri Arora PhD,gayatri_arora_phd@ankunding.test,Aliquid beatae modi. Velit rerum dolorem. Deserunt omnis eius.
180476,267928,Gaurang Devar,gaurang_devar@wuckert-stiedemann.test,Ullam quibusdam porro. Qui sed autem. Eaque sint dolorem.
180475,267927,Himadri Talwar,talwar_himadri@gorczany.test,Harum voluptatem culpa. Dolores autem commodi. Aut quos amet.
180474,267927,Chandira Achari,chandira_achari@weber-kulas.test,Quia voluptatem doloribus. Sapiente quia molestiae.
180473,267926,Miss Adityanandana Tandon,adityanandana_miss_tandon@lubowitz.test,Itaque cupiditate esse.
180472,267926,Somu Embranthiri,somu_embranthiri@lind.example,Dignissimos asperiores nulla. Accusantium quaerat error. Est nisi fuga. Et et unde.
180471,267923,Atmaja Rana,rana_atmaja@sipes.example,Delectus ut qui. Ab neque non.
180470,267923,Bilva Nayar JD,nayar_jd_bilva@corkery.test,Omnis eveniet et. Doloribus molestias autem. Est cum dolore.
180469,267922,Keerti Dwivedi,dwivedi_keerti@hane.example,Iure cum ducimus. Quia qui et. Et necessitatibus est. Repellat et rerum.
180468,267922,The Hon. Adwitiya Ganaka,adwitiya_the_hon_ganaka@oreilly.example,Aut laborum et. Nihil praesentium et. Consequatur maxime distinctio. Ut sunt explicabo.
180467,267921,Lakshmidhar Varma VM,varma_vm_lakshmidhar@sipes.test,Ut est suscipit.
