id,post_id,name,email,body
187511,278672,Aaditya Shukla,aaditya_shukla@conn.example,Dolores voluptatum ea.
187510,278671,Manisha Joshi Ret.,joshi_manisha_ret@batz.example,Deleniti tempore alias.
187509,278671,Bhaves Adiga,adiga_bhaves@yundt.example,Sapiente itaque non.
187508,278669,Harinarayan Saini,saini_harinarayan@wilderman-heller.example,Quod quas voluptatum. Sint voluptatum iusto.
187507,278669,Devasree Iyengar,devasree_iyengar@deckow.test,Veritatis sit in. Cumque itaque dolor. Non nihil ducimus. Eos distinctio et.
187506,278668,Chandra Agarwal Ret.,agarwal_chandra_ret@nicolas.test,Sed est sit. Ducimus dolorem deserunt. Eum nihil quis. Dolorem omnis architecto.
187505,278668,Gandharv Bandopadhyay,gandharv_bandopadhyay@lockman.test,Molestias illo cum. Atque quam eos. Qui et quo. Aut eum eius.
187504,278666,Shivakari Dutta,shivakari_dutta@lind.example,Sit voluptates dolorem.
187503,278666,Chanakya Shukla PhD,chanakya_phd_shukla@hackett.example,Tempore molestias natus.
187502,278662,Geetanjali Jain,jain_geetanjali@fadel-strosin.example,Impedit consequatur illo.
187501,278662,Bhushan Mehra,bhushan_mehra@hoeger-kuhic.test,Error vel accusantium. Libero provident debitis. Voluptatum est adipisci.
187500,278661,Chandraayan Patel,patel_chandraayan@hansen-erdman.test,Quibusdam sunt eos. Veniam numquam quia. Qui sed non.
187499,278661,Prof. Bhagwati Somayaji,somayaji_prof_bhagwati@anderson.test,Sint accusamus laborum.
187498,278658,Bhudev Asan,bhudev_asan@rice.test,Non quis maiores. Est occaecati impedit. Laboriosam quis aliquid.
187497,278657,Dayaanidhi Chattopadhyay Esq.,esq_chattopadhyay_dayaanidhi@greenfelder.example,Voluptas magnam ut. Sunt qui temporibus. Sint natus quis. Cupiditate at et.
187496,278655,Lakshmidhar Devar LLD,lakshmidhar_devar_lld@miller-russel.test,Amet impedit voluptatem. Ullam ut aut. Non sed facilis. Ipsam dolores repellat.
187495,278655,Digambara Gowda,digambara_gowda@tromp-crona.test,Ipsam qui quaerat.
187494,278654,Bhima Kocchar,kocchar_bhima@leannon.test,Blanditiis ut voluptatum. Id dolores unde. Sed quia libero.
187493,278654,Chandrabhan Jain,chandrabhan_jain@bosco.example,Incidunt amet sunt. A quo tempora. Aut porro odio. Quae dolorem saepe.
187492,278653,Bhaswar Rana,bhaswar_rana@kuvalis.test,Sint odit error. Reiciendis possimus unde. Eum officiis omnis.
187491,278653,Adripathi Verma II,verma_adripathi_ii@gusikowski-gerlach.test,Neque quisquam voluptatum. Omnis cupiditate occaecati. Sapiente doloremque dolorem. Saepe officiis cum.
187490,278652,Amb. Dhyanesh Prajapat,prajapat_dhyanesh_amb@brown.example,Perspiciatis possimus architecto. Quo pariatur amet. At velit unde.
187489,278651,Nagabhushanam Jha I,jha_nagabhushanam_i@trantow.example,Accusamus omnis aut.
187488,278651,Rakesh Gupta,rakesh_gupta@rice-howell.example,Sequi ut consequatur. Non quae quis. Et aperiam eos.
187487,278650,Rep. Shashi Jain,shashi_jain_rep@bosco.test,Facilis quidem similique. Aspernatur cupiditate quidem. Qui quas eveniet.
187486,278650,Rep. Aatreya Ahuja,aatreya_ahuja_rep@lindgren.test,Explicabo eos et. Quam ipsam architecto. Porro est autem. Magnam quia debitis.
187485,278649,Akshata Butt,akshata_butt@okuneva.example,Aut vitae consequuntur. Facere et impedit. Aut quas et. Expedita rem facere.
187484,278649,Chandraayan Talwar,talwar_chandraayan@weimann-gutmann.test,Alias consequatur sunt.
187483,278646,Sujata Nambeesan,nambeesan_sujata@vonrueden.example,Odio dolores sit. Ab eveniet esse. Excepturi consequatur illum. Unde et sequi.
187482,278645,Rameshwar Achari,rameshwar_achari@jakubowski.example,Sed consequatur tempora.
187481,278644,Siddhi Iyengar DVM,dvm_iyengar_siddhi@smitham.test,Consequatur tenetur impedit. Officiis ex voluptate. Repudiandae reprehenderit ut.
187480,278644,Adripathi Gandhi,adripathi_gandhi@homenick.example,Voluptate totam laborum. Aut incidunt optio. Nemo mollitia ut. Rerum quo quia.
187479,278643,Mr. Rajendra Adiga,mr_adiga_rajendra@hills.test,Voluptatem sequi esse. Voluptatem distinctio voluptatem. Ut hic repudiandae. Et veritatis autem.
187478,278643,Aagam Kocchar,aagam_kocchar@ernser-rath.test,Iste officiis sunt. Eos et perspiciatis. Incidunt autem dolor.
187477,278642,Brajendra Malik,malik_brajendra@hilpert-gleason.example,Velit accusantium aperiam. Mollitia accusamus ea. Dignissimos nesciunt qui. Nihil ea velit.
187476,278642,Bhadrak Tandon,bhadrak_tandon@erdman-stiedemann.example,Id ea sed. Et qui quod. Est aut libero.
187475,278640,Krishnadasa Asan,krishnadasa_asan@shanahan-olson.test,Et veniam dignissimos. Ut amet id. Labore et dignissimos.
187474,278638,Javas Mishra,mishra_javas@ondricka.example,Ea officia aut. Expedita et et.
187473,278638,Shresth Mishra Sr.,mishra_shresth_sr@jacobi.test,Nam repudiandae velit.
187472,278637,Prathamesh Reddy,reddy_prathamesh@turcotte.example,Eaque autem qui.
187471,278636,Akroor Kapoor,kapoor_akroor@hoeger-lueilwitz.test,Autem corrupti nostrum. Beatae ut iste.
187470,278636,Prof. Amritambu Kocchar,kocchar_amritambu_prof@morissette.test,Dolore dolorem ab. Sed esse autem.
187469,278634,Vasundhara Kocchar,vasundhara_kocchar@cremin.example,Quia quia fugiat. Aut molestiae explicabo. Necessitatibus eius omnis.
187468,278634,Damodara Arora,damodara_arora@leffler.example,Aspernatur aut harum. Tenetur vitae voluptas. Cupiditate quia enim. Nobis eaque quo.
187467,278633,Aadrika Acharya,aadrika_acharya@bahringer.example,Quas quos doloremque. Dignissimos temporibus ea. Necessitatibus ut quae. Expedita ut dolor.
187466,278633,Daksha Ahluwalia,ahluwalia_daksha@rolfson.example,Sed aut sit. Et officiis aspernatur. Eveniet quia quidem. Esse et tenetur.
187465,278630,Adityanandan Marar,adityanandan_marar@bailey.test,Aut hic quia.
187464,278626,Opalina Bharadwaj,bharadwaj_opalina@johnston.test,Voluptatibus labore et.
187463,278626,Prof. Dhana Verma,dhana_verma_prof@armstrong.example,Ea sint mollitia.
187462,278623,Anunay Mehrotra,mehrotra_anunay@howe.example,Est repudiandae doloribus. Assumenda est qui. Aliquid omnis ipsam. Perspiciatis ipsum sed.
187461,278623,Karthik Varma CPA,varma_cpa_karthik@heaney.test,Aliquam ut mollitia. Temporibus quasi maxime. Provident et quae. Et numquam fugit.
187460,278622,Bhagwati Tandon,bhagwati_tandon@abshire.example,Et error porro. Rem fugit autem. Et et cupiditate.
187459,278621,Mr. Oormila Singh,singh_oormila_mr@hickle.example,Laudantium expedita sunt. Dolorem ad magni. In voluptas aliquid.
187458,278620,Ramesh Gandhi JD,ramesh_jd_gandhi@dubuque.example,Accusantium temporibus hic.
187457,278620,Udai Trivedi,trivedi_udai@becker.example,Sint suscipit voluptas.
187456,278619,Pres. Vidur Marar,vidur_marar_pres@pagac.example,Rerum eos qui.
187455,278618,Sen. Rukmin Pandey,sen_rukmin_pandey@welch.example,Sint quo debitis. Sit velit eaque.
187454,278617,Kamla Varman DC,dc_varman_kamla@prosacco-bosco.test,Ut et cumque. Et ex dignissimos.
187453,278616,Ms. Kamlesh Kocchar,kamlesh_kocchar_ms@hahn-abbott.test,Dolor rerum numquam. Est et sunt. Doloribus voluptate et. Ab sit fugit.
187405,278578,Dr. Suma Kapoor,dr_kapoor_suma@dickens.example,Odit assumenda omnis. Qui autem laudantium. Eius voluptatem atque.
187404,278578,Puneet Varman,varman_puneet@sauer.example,Dolorem alias et.
187372,278447,Ghanaanand Mukhopadhyay,mukhopadhyay_ghanaanand@veum-ritchie.test,Reprehenderit sint rerum. Doloribus aut exercitationem. Voluptates sapiente tempora. Quisquam eaque ipsum.
187369,278443,Lakshmi Chaturvedi III,chaturvedi_lakshmi_iii@rice.example,Doloremque dolor incidunt. Et voluptas et. Nemo aut magnam. Et recusandae facilis.
187363,278438,Gajaadhar Dubashi,gajaadhar_dubashi@christiansen.example,Voluptas quo in. Nesciunt consequatur sint. Qui quis et. Ea dolores impedit.
187360,278434,Gopal Asan,gopal_asan@abshire-wiza.example,Sit molestiae et.
187359,278434,Gautam Achari,gautam_achari@cassin.test,Id eum tempora. Ipsam omnis aut. Qui et voluptatum.
187357,278433,Ekaaksh Shah DO,do_ekaaksh_shah@kuphal-macgyver.test,Sit ut et.
187356,278399,Fr. Kumari Iyengar,iyengar_fr_kumari@ondricka.example,Eligendi sit voluptatibus. Cupiditate possimus eum. Voluptates nostrum sint. Accusamus et dolorem.
187350,278392,Rev. Ojaswini Kaul,rev_ojaswini_kaul@koss-daniel.example,Ut nulla ad.
187344,278313,Prof. Digambar Tandon,tandon_digambar_prof@grady-orn.test,Odio ut sequi. Impedit perferendis est. Natus perferendis amet. Autem sit ab.
187343,278310,Girik Acharya,acharya_girik@rosenbaum.example,Iure aut quisquam. Iusto neque distinctio. Incidunt laudantium sequi.
187342,278310,Damayanti Ganaka I,damayanti_ganaka_i@hammes.test,Doloremque vero doloribus. Culpa est officia. Voluptate hic veritatis.
187341,278309,Mandaakin Pothuvaal,mandaakin_pothuvaal@swaniawski.test,Qui accusamus quod. Sapiente nihil velit. Id sapiente et. Porro recusandae et.
187340,278309,Amb. Budhil Khatri,budhil_khatri_amb@schulist.test,Sed distinctio qui.
187339,278308,Akshainie Dhawan,akshainie_dhawan@graham.example,Tempora ullam molestias. Ipsam quia tenetur.
187338,278307,Shubha Adiga,shubha_adiga@sauer-kertzmann.test,Ut cupiditate hic. Veniam in quia. Consequatur accusamus dolores.
187337,278307,Rev. Aadi Gowda,aadi_gowda_rev@schultz.example,Et aliquid autem.
187336,278306,Atmaja Iyer,atmaja_iyer@murphy-reichert.test,Dicta harum ut. Dignissimos debitis explicabo.
187335,278305,Sameer Trivedi Jr.,jr_trivedi_sameer@kovacek-stehr.example,Eaque assumenda deserunt. Quasi harum dolorum. Libero esse asperiores. Architecto sed veniam.
187334,278305,Kama Kaniyar,kaniyar_kama@koepp-schulist.test,Vel et quis. Fuga molestiae facilis. Vel et ea.
187333,278303,Mr. Bela Somayaji,somayaji_bela_mr@schimmel-runolfsdottir.test,Alias autem molestiae. Consequatur quibusdam ipsum. Ad corrupti id.
187332,278302,Amb. Anish Asan,anish_amb_asan@hilpert.example,Quidem alias qui. Inventore voluptatem blanditiis. Explicabo eius minima. Et animi quo.
187325,278296,Prof. Priya Varrier,prof_varrier_priya@heathcote.test,Et molestiae corrupti. Culpa omnis cum.
187323,278293,Geeta Bharadwaj,geeta_bharadwaj@stokes-feest.example,Nostrum voluptatem aut. Vitae praesentium ratione.
187322,278292,Chakravartee Naik,naik_chakravartee@brekke-balistreri.test,Sit blanditiis libero. Earum nostrum illo. Qui odit quod. Voluptatem sint eligendi.
187321,278292,Rev. Subhasini Guha,subhasini_guha_rev@goldner-connelly.example,Dolor iure accusamus. Qui ut dolores.
187314,278287,Shanti Patil,shanti_patil@hilpert-hilll.test,Sit in nisi.
187313,278286,Dr. Bhaanumati Johar,bhaanumati_johar_dr@spinka.example,Fuga qui sit. Vero est quas. Minima nulla qui. Quisquam voluptatibus sint.
187309,278283,Shantanu Nambeesan,nambeesan_shantanu@prohaska-hodkiewicz.test,Corporis quos similique. Distinctio fugiat praesentium.
187308,278282,Miss Bhupen Kocchar,miss_bhupen_kocchar@connelly-will.test,Est velit natus.
187307,278281,Charuvrat Butt DDS,butt_dds_charuvrat@rippin.test,Culpa sed rem. Facilis esse labore.
187306,278280,Adheesh Jha DDS,jha_dds_adheesh@marquardt.example,Quibusdam iste est. Rem ex et.
187305,278280,Sen. Kamala Varman,sen_kamala_varman@harvey.example,Sunt quod amet. Recusandae necessitatibus sed. Et quaerat numquam. Culpa et aliquid.
187304,278278,Kirti Chaturvedi PhD,kirti_chaturvedi_phd@wolf.example,Maiores in similique.
187303,278278,Balachandra Shah DC,dc_shah_balachandra@klocko-schulist.example,Aut vel porro. Harum sequi hic. Et sunt autem. Quae quaerat laboriosam.
187302,278277,Chakradhar Agarwal,agarwal_chakradhar@grant.test,Labore enim exercitationem. Eum animi id. Et qui sunt.
187301,278277,Aamod Agarwal Jr.,aamod_jr_agarwal@bahringer-goyette.example,Debitis qui mollitia. Nisi dignissimos neque. Dignissimos corporis in.
187300,278276,Balgopal Mukhopadhyay,mukhopadhyay_balgopal@emard.test,Minima voluptatem aut.
187299,278275,Siddhi Reddy,reddy_siddhi@buckridge.example,Similique aut corrupti. Vero consequatur voluptatem. Alias impedit eos.
187298,278273,Dev Tandon,tandon_dev@brakus.example,Ea voluptatum impedit. Pariatur non doloribus.
187297,278272,Prathamesh Namboothiri,prathamesh_namboothiri@mertz-bogan.example,Veritatis esse in. Illo dolor ea. Nemo sit consequatur. Quibusdam aliquid commodi.
187296,278272,Chandrani Pandey,chandrani_pandey@nitzsche.test,Et et qui. Et placeat est. Blanditiis quidem enim. Deleniti qui iste.
187295,278271,Kamala Chattopadhyay,chattopadhyay_kamala@prohaska.example,Sit alias consectetur. Magni fuga qui. Ipsum et aut. Voluptas quaerat commodi.
187294,278271,Dhanu Ahuja,dhanu_ahuja@shanahan.example,Et alias sunt. Quo voluptas eum. Praesentium magni ut.
187293,278269,Radha Chopra,radha_chopra@quitzon.test,Impedit vitae quia.
187292,278268,The Hon. Nagabhushanam Naik,nagabhushanam_hon_the_naik@fay-bednar.example,Aliquam consequatur et. Adipisci deserunt inventore. Dolorem doloribus eaque. Perferendis optio aut.
187291,278268,Akshita Chattopadhyay,akshita_chattopadhyay@block.example,Id autem reprehenderit.
187290,278266,Msgr. Ajit Iyer,ajit_iyer_msgr@senger-ohara.example,Quibusdam quasi repudiandae.
187289,278266,Amritambu Talwar,amritambu_talwar@jenkins-connelly.test,Ratione esse sint. Sunt in deleniti. Eum corrupti quis. Consectetur vitae facere.
187288,278265,Diptendu Bandopadhyay,bandopadhyay_diptendu@sanford.test,Quam et omnis.
187287,278265,Bankim Sharma,bankim_sharma@denesik.test,Laudantium ducimus ratione. Omnis deleniti id. Labore tempore ut.
187286,278264,Anilabh Patel,anilabh_patel@ledner-ratke.example,Autem et cum.
187285,278262,Bela Sinha,bela_sinha@orn.test,Assumenda ducimus laboriosam. Et optio ipsa.
187284,278262,Aasa Panicker,aasa_panicker@waters.test,Harum dolores fuga. Officia quia recusandae.
187283,278260,Vedanga Gowda,vedanga_gowda@boyer-walsh.example,Cum perferendis iusto.
187282,278260,Kanishka Pillai,pillai_kanishka@schiller.test,Maiores aut voluptatem.
187281,278259,Anil Saini,anil_saini@stehr.test,Doloremque quos enim.
187280,278259,Bhupen Pillai,pillai_bhupen@hamill.example,Doloribus deleniti quis. Numquam possimus perspiciatis.
187279,278258,Dhaanyalakshmi Varman,varman_dhaanyalakshmi@keebler.test,Beatae ducimus eos. Non voluptatum perferendis. Tenetur dignissimos laborum.
187278,278257,Chaanakya Ganaka,ganaka_chaanakya@kirlin.test,Tempore eos ut. Laboriosam cupiditate quas.
187277,278257,Mrs. Tushar Achari,achari_mrs_tushar@green.test,Non sunt quia. Qui voluptatem qui. Doloremque repudiandae tenetur.
187276,278255,Diptendu Iyer,iyer_diptendu@crist.example,Numquam quisquam rerum. Qui suscipit facere. Magnam praesentium atque.
187275,278255,Rudra Joshi,joshi_rudra@senger.test,Voluptatum suscipit id. Officiis cumque dolor. Et iusto saepe.
187274,278254,Divya Khanna Sr.,khanna_sr_divya@stamm.test,Et aut possimus. Quo sint nihil. Tempora architecto sunt.
187273,278251,The Hon. Chakravarti Desai,hon_chakravarti_the_desai@friesen-metz.test,Sunt vitae asperiores. Nam quia accusamus. Minima ullam quis.
187272,278251,Sanka Desai,desai_sanka@kozey.example,Et perferendis quidem.
186492,277096,Dr. Bhadra Namboothiri,bhadra_dr_namboothiri@moore-towne.test,Voluptate accusamus facere. Molestiae culpa omnis. Ullam dolorum quis. Qui voluptatem nemo.
186490,277095,Shakti Singh,shakti_singh@gulgowski-jones.test,Qui optio sunt. Laboriosam voluptas nobis. Voluptatem incidunt corporis. Et rerum et.
186489,277093,Msgr. Girindra Gandhi,gandhi_msgr_girindra@mohr.example,Voluptas ex suscipit. Voluptas et mollitia.
186488,277091,Sher Achari,achari_sher@koch.test,Et aut mollitia.
186487,277089,Mr. Kumari Kakkar,kumari_kakkar_mr@morar-koelpin.test,Officia qui tenetur. Suscipit repudiandae qui. Fugit consectetur hic. Aut deserunt explicabo.
186486,277089,Meena Somayaji,meena_somayaji@braun.example,Ipsam ut officiis. Sit animi fugiat. Tenetur dolore nihil. Est totam vel.
186485,277088,Amarnath Khanna Ret.,ret_amarnath_khanna@skiles.test,Est fugit vitae. Velit earum nesciunt. Nostrum ipsum exercitationem.
186484,277087,Brajendra Mukhopadhyay,brajendra_mukhopadhyay@koss.test,Dolor quis aut.
186483,277087,Suma Achari,suma_achari@harber-willms.example,Quia eligendi cum. Tempora debitis inventore. Eaque deserunt eos. Omnis sint cum.
186482,277086,Arindam Shah,shah_arindam@reichel.test,Vero distinctio sapiente. Architecto inventore quia. Quas quia minus. Unde in saepe.
186481,277082,Dipesh Shah,shah_dipesh@prohaska-nicolas.test,Qui magni voluptas. Quod voluptas est. Ut omnis nesciunt.
186480,277081,Chatur Dhawan PhD,chatur_phd_dhawan@kohler.test,Aliquid et eum. Unde pariatur totam. Consectetur nam facere.
186479,277081,Chandra Asan,chandra_asan@lemke.example,Praesentium a in. Nulla accusamus harum. Magni error distinctio.
186478,277079,Narinder Ahuja II,narinder_ahuja_ii@ebert.test,Temporibus omnis quasi. Dolorem beatae odio. Quasi fugit maxime.
186477,277079,Swarnalata Asan,swarnalata_asan@harber-emmerich.test,Esse saepe sunt. Sed harum sint. Maiores cum dolores.
186476,277078,Gautam Chopra,chopra_gautam@hartmann-wuckert.example,Excepturi magni non.
186475,277076,Kanak Adiga,kanak_adiga@treutel.example,Architecto vero omnis. Autem quidem excepturi.
186474,277076,Bala Bhattathiri,bhattathiri_bala@frami.example,Nulla reprehenderit nihil. Ipsa ut et. Velit consequatur reiciendis.
186473,277075,Advaya Varman,advaya_varman@gerlach.example,Laudantium autem non.
186472,277073,Dipendra Varrier,dipendra_varrier@upton.test,Est sed illo.
186471,277072,Yogesh Tagore,yogesh_tagore@cartwright.example,Rerum repudiandae eaque. Voluptatem ipsa sequi. Consequatur rem quod.
186470,277072,Rev. Devvrat Pilla,devvrat_rev_pilla@weimann.example,Ex ut voluptates. Excepturi velit dignissimos.
186469,277071,Meenakshi Malik,malik_meenakshi@ferry.example,Molestiae nostrum est. Voluptates voluptate eveniet. Magni aut accusantium. Adipisci tempore deleniti.
186468,277070,Garud Reddy Jr.,jr_garud_reddy@tillman-goyette.test,Et non ex. Aliquam minus beatae.
186467,277070,Durga Gupta,durga_gupta@pacocha.test,Inventore quo atque. Neque saepe in. Minima in debitis. Commodi quam dignissimos.
186349,277008,Sukanya Gandhi,sukanya_gandhi@walker.test,Natus ut voluptas. Autem possimus enim. Molestias consequuntur sequi. Earum dolores in.
185982,275443,Rep. Kanak Kapoor,rep_kapoor_kanak@bradtke-jast.test,Praesentium aut odit. Quia numquam qui. Delectus nihil quisquam.
185981,275443,Dayaananda Bhat,bhat_dayaananda@schmeler-thiel.example,Quibusdam sit aut. Ut tempora suscipit.
185978,275438,Ashlesh Dutta,dutta_ashlesh@botsford-powlowski.test,Doloribus a ipsa. Sapiente quos facilis.
185972,275432,Rev. Bhramar Desai,desai_rev_bhramar@moore.test,Distinctio et aut.
185971,275431,Sanya Kaniyar,kaniyar_sanya@fadel-kirlin.example,Sunt tenetur voluptatem. Dicta iste provident. Magnam dolores aut. Consequatur veritatis est.
185970,275431,Mayoor Varma,mayoor_varma@rippin-brakus.test,Sed aspernatur laudantium. Et voluptatem cum. Eum dolorum repudiandae. Ratione reiciendis temporibus.
185969,275430,Lalita Bhat,lalita_bhat@reinger.example,Perspiciatis et sint.
185968,275430,Abhirath Ahuja Esq.,ahuja_esq_abhirath@koelpin-pollich.test,Inventore nisi perspiciatis. Repudiandae dolor et. Velit sit labore. Eaque magni laudantium.
185967,275428,Mr. Dhanalakshmi Gowda,gowda_dhanalakshmi_mr@franecki.example,Tenetur in voluptas. Aspernatur autem provident. Sunt ad et. Architecto voluptatibus rerum.
185966,275428,Nikita Talwar,nikita_talwar@gorczany-mcglynn.example,Et ab est. In cum est.
185965,275427,Veda Talwar,veda_talwar@schimmel.test,Ullam qui sint.
185964,275425,Bhagirathi Adiga,bhagirathi_adiga@predovic.test,Qui sunt dolorem.
185963,275423,Mrs. Devajyoti Jha,devajyoti_mrs_jha@yost.test,Aliquam quo ut. Ipsum et iste. Ut maiores rerum. Itaque tenetur nam.
185962,275423,Miss Trilokesh Shah,miss_shah_trilokesh@windler.test,Distinctio non laborum. Enim beatae quod.
185961,275422,Brahmaanand Chaturvedi,chaturvedi_brahmaanand@nitzsche.example,Ea est iste. Dolorem eum veniam.
185960,275421,Goutam Pandey,pandey_goutam@oreilly-hammes.test,Enim qui nam. Voluptas tempora amet.
185959,275421,The Hon. Sushma Sinha,hon_the_sushma_sinha@littel-hyatt.example,Voluptas asperiores sit.
185958,275419,Bhupen Mahajan Jr.,jr_bhupen_mahajan@brown.test,Velit eum repellat. In ex ipsa. Provident consequatur sapiente. Odio minima qui.
185957,275417,Rep. Kalpana Dhawan,rep_kalpana_dhawan@romaguera.example,In dolor provident. Rerum qui modi.
185956,275417,Chandravati Kakkar,chandravati_kakkar@lindgren.example,Iusto quos voluptas.
185955,275416,Msgr. Bilva Deshpande,bilva_msgr_deshpande@sauer-stamm.example,Quidem quasi velit. Quis nisi minima.
185924,275327,Shreya Singh,shreya_singh@rice-koch.test,Qui ut deleniti.
185923,275326,Mrs. Bandhu Singh,bandhu_singh_mrs@ebert.example,Quidem hic fugit. Minima officia laudantium. Dolor totam corporis. Quibusdam unde ea.
185919,275322,Himadri Naik,naik_himadri@schmitt-murphy.test,Eos fuga sapiente. Fugit omnis molestiae. Nemo sunt et. Quas accusamus quia.
185918,275321,Fr. Akshat Prajapat,akshat_prajapat_fr@sauer.example,Aliquam laborum quasi. Nisi architecto qui.
185917,275321,Vaishno Nehru,nehru_vaishno@weber-berge.example,Non eos doloribus. Placeat vitae et. Totam et officia. Molestias in ipsam.
185916,275320,Gajbaahu Marar,gajbaahu_marar@lesch-dietrich.test,Alias accusamus id.
185908,275312,Bhoj Arora,bhoj_arora@west.test,Et voluptas ratione. Ut nihil fugiat. Natus consequatur officiis. Delectus fuga ex.
185907,275312,Anunay Chopra,chopra_anunay@barrows.example,Labore magni fugiat. Voluptas quis dolorem. Sit autem recusandae. Quis qui delectus.
185906,275311,Pres. Shwet Bhattacharya,bhattacharya_shwet_pres@collier.test,Vero id et. Nihil voluptatem exercitationem. Provident illo eaque.
185905,275310,Vaishnavi Namboothiri,namboothiri_vaishnavi@price-kutch.test,Placeat non quis. Praesentium perferendis quis. Delectus et officia.
185904,275310,Gov. Shreya Trivedi,shreya_trivedi_gov@kerluke-shanahan.test,Similique dicta repellat. Ut dicta velit.
185903,275309,Mr. Jyoti Guha,mr_guha_jyoti@beatty.example,Magni vel est. Beatae adipisci explicabo. Hic suscipit velit. Repudiandae aut eaque.
185902,275309,Nanda Marar,marar_nanda@senger.example,Sint qui veritatis. Rerum quibusdam nisi. Unde et esse. Magni possimus illo.
185901,275308,Amb. Gandharva Embranthiri,embranthiri_gandharva_amb@reichel.example,Totam rerum illo. Minima enim rerum. Magnam et impedit.
185900,275308,Jyoti Devar,devar_jyoti@balistreri-larson.example,Ut magnam eos. Possimus quos occaecati.
185730,275123,Chitrangada Rana,chitrangada_rana@heidenreich.example,Voluptatem sint nisi.
185729,275122,Bharadwaj Iyengar,iyengar_bharadwaj@greenfelder.test,Perspiciatis et et. Est iusto est. Illum est iure. Cum nesciunt quaerat.
185728,275122,Kumari Pilla,pilla_kumari@harris.example,Quia eos similique. Ad ipsum tenetur. Sed necessitatibus reiciendis. Dolor velit distinctio.
185720,275113,Gajadhar Patil,gajadhar_patil@jones.test,Qui temporibus sint.
185719,275113,Buddhana Shah,shah_buddhana@bode-hegmann.example,Ipsum rerum itaque. Quasi ut culpa. Dolor recusandae quod. Ipsam nesciunt modi.
185718,275112,Deeptimayee Malik,deeptimayee_malik@anderson.example,Qui facere necessitatibus. Fugit nostrum magnam. Explicabo quam aliquid. Dolor rerum ratione.
185717,275112,Gautam Khatri,gautam_khatri@white.test,Est fugit ducimus.
185716,275111,Brahma Bhat,brahma_bhat@kemmer-lockman.test,Sint tempora nihil. Nihil nam aut. Distinctio consequatur culpa. Natus earum in.
185715,275108,Bhishma Kakkar,bhishma_kakkar@zulauf-donnelly.test,Dolores optio officiis. Repellendus accusantium perspiciatis. Aliquam inventore quia. Numquam nesciunt et.
185714,275108,The Hon. Anjushri Chaturvedi,anjushri_the_hon_chaturvedi@sanford.example,Voluptatum est et. Recusandae molestiae omnis. Sit modi voluptate.
185713,275107,Rev. Bhasvan Bhattathiri,rev_bhattathiri_bhasvan@oreilly-zulauf.example,Est omnis aut. Amet nemo est.
185712,275107,Msgr. Brahmaanand Rana,rana_brahmaanand_msgr@berge-mann.example,Rerum minus tempora. Totam et consequuntur. Incidunt ut quo. Ullam ipsa velit.
185711,275106,Dwaipayana Dwivedi PhD,phd_dwivedi_dwaipayana@fahey.example,Alias enim distinctio. Magni animi provident. Adipisci deserunt occaecati.
185710,275105,Bhisham Gandhi,bhisham_gandhi@mohr.example,Neque sed quia. Et quia magni. Quis necessitatibus dolores. Occaecati eum dolorem.
185709,275103,Amb. Chidambar Tagore,chidambar_amb_tagore@smith.example,Minus error illo. Quod dicta non.
185708,275102,Balagovind Asan IV,asan_balagovind_iv@zemlak.test,Amet deleniti ex. Ut sunt quis. Veniam aut repellat. Eos rem veniam.
185707,275102,Sarvin Adiga,sarvin_adiga@smitham.example,Sed qui excepturi.
185706,275101,Bhishma Sharma,bhishma_sharma@jast-ullrich.example,Asperiores et a. Sit provident sed.
185705,275101,Rep. Rageshwari Dubashi,rep_rageshwari_dubashi@kessler.test,Vitae dolor rerum. Aut molestiae quae. Omnis deserunt tenetur. Magni maiores tempore.
185704,275100,Rep. Gotum Bhat,gotum_bhat_rep@robel-hoppe.test,Tempore quis officia. Beatae natus voluptatum. Sequi quam in. Sit nam non.
185703,275099,Digambara Rana,digambara_rana@windler.example,Aut dolores ducimus. Quam tempore in.
185702,275099,Bala Johar,bala_johar@purdy-hickle.example,Nisi est hic. Aliquid et eveniet. Est ipsam animi.
185701,275098,Abhaya Bhat,bhat_abhaya@kuphal.example,Eaque tenetur tempore. Id dolor commodi.
185700,275098,Bhramar Bharadwaj,bhramar_bharadwaj@hand.test,Fuga molestiae beatae. Libero aut nostrum.
185699,275096,Amb. Tanirika Dubashi,dubashi_amb_tanirika@jaskolski.test,Voluptates laudantium voluptas. Omnis aut natus.
185698,275096,Chandra Butt I,chandra_butt_i@botsford.example,Quia excepturi aut. Dolorum consectetur ea.
185697,275093,Aryan Arora DC,aryan_arora_dc@lehner.test,Nihil facilis quo.
185696,275093,Charumati Dutta,charumati_dutta@gleichner.test,Porro necessitatibus quia. Aperiam nam nisi. Provident itaque totam.
